id,title,readyInMinutes,servings,image,cuisines,dish,ingredients,grocery,instructions
648758,Kari Kepala Ikan Bersama Belimbing Buluh (Fish Head Curry),45,4,https://spoonacular.com/recipeImages/648758-312x231.jpg,"['Indian', 'Asian']",1,"{'black mustard seeds': '0.25 tsp', 'chili powder': '0.25 tbsp', 'coconut milk': '0.13 cup', 'coriander powder': '0.13 tbsp', 'cumin powder': '0.25 tsp', 'curry leaves': '0.5 sprigs', 'fennel powder': '0.25 tsp', 'fenugreek seeds': '0.13 tbsp', 'garlic paste': '0.25 tablespoon', 'ginger paste': '0.25 tablespoon', 'mackerel fish': '0.25 large', 'oil': '0.75 tablespoons', 'onion': '0.25 tbsp', 'red pepper powder': '0.25 tsp', 'salt': '0.25 teaspoon', 'turmeric powder': '0.25 tsp'}","['black mustard seeds', 'chili powder', 'coconut milk', 'coriander powder', 'cumin powder', 'curry leaves', 'fennel powder', 'fenugreek seeds', 'garlic paste', 'ginger paste', 'mackerel fish', 'oil', 'onion', 'red pepper powder', 'salt', 'turmeric powder']","Rub fish with turmeric powder and keep aside.Heat oil and saute ginger, garlic and onion paste.Splatter in mustard and fenugreek seeds.Add curry paste and fry till oil splitsPour 1/2 liter of water; stir and gently drop in fish pieces.Simmer till fish is cooked.Season with salt; add belimbing and curry leaves.Gently stir.Lastly pour coconut milk.Stir and remove from heat."
637285,Catfish Tacos With Pimento Cheese Crema and Watermelon Salsa,45,4,https://spoonacular.com/recipeImages/637285-312x231.jpg,['Mexican'],1,"{'avocado': '0.25 small', 'black pepper': '0.13 tablespoon', 'buttermilk': '0.13 cup', 'canola oil': '1.0 servings', 'catfish': '0.13 pound', 'celery seed': '0.13 teaspoon', 'corn tortillas': '1.5 small', 'cream cheese': '1.0 ounces', 'Crema Mexicana': '0.06 cup', 'fresh cilantro': '0.5 tablespoons', 'garlic': '0.5 cloves', 'juice of lime': '0.25 ', 'kosher salt': '1.0 servings', 'lemon zest': '0.25 ', 'mayonnaise': '0.06 cup', 'mozzarella cheese': '0.06 cup', 'paprika': '0.25 teaspoon', 'persian cucumber': '0.25 ', 'pimentos': '0.5 tablespoons', 'red onion': '0.13 small', 'serrano pepper': '0.25 ', 'shredded mexican cheese blend': '0.25 cup', 'sriracha': '0.25 teaspoon', 'tabasco': '0.13 tablespoon', 'tomato': '0.25 ', 'watermelon': '0.25 cup', 'yellow cornmeal': '0.13 cup'}","['avocado', 'black pepper', 'buttermilk', 'canola oil', 'catfish', 'celery seed', 'corn tortillas', 'cream cheese', 'Crema Mexicana', 'fresh cilantro', 'garlic', 'juice of lime', 'kosher salt', 'lemon zest', 'mayonnaise', 'mozzarella cheese', 'paprika', 'persian cucumber', 'pimentos', 'red onion', 'serrano pepper', 'shredded mexican cheese blend', 'sriracha', 'tabasco', 'tomato', 'watermelon', 'yellow cornmeal']","Starting with the catfish, whisk together the buttermilk, lemon zest, sriracha and garlic.Add the fish, coating well. Cover and pop into the fridge for an hour.While the fish chills, mix together cornmeal, salt, pepper and paprika. Set aside.For the sauce, beat the cream cheese in the bowl of an electric mixer until smooth."
662089,Stuffed Shells With Smoked Whitefish In A Lemon Béchamel Sauce,45,8,https://spoonacular.com/recipeImages/662089-312x231.jpg,[],1,"{'all purpose flour': '0.38 tbsp', 'butter': '0.13 stick', 'egg yolk': '0.13 ', 'fresh basil leaves': '0.06 cup', 'garlic': '0.75 cloves', 'ground pepper': '0.03 teaspoon', 'half and half': '0.75 cups', 'noodles': '0.13 box', 'lemon zest': '0.25 teaspoons', 'nutmeg': '0.13 pinch', 'parmesan': '0.09 cup', 'salt': '0.06 teaspoon', 'shredded mozzarella': '0.13 cup', 'skim milk ricotta cheese': '0.13 cup', 'white pepper': '0.03 teaspoon', 'whitefish': '0.13 pound'}","['all purpose flour', 'butter', 'egg yolk', 'fresh basil leaves', 'garlic', 'ground pepper', 'half and half', 'noodles', 'lemon zest', 'nutmeg', 'parmesan', 'salt', 'shredded mozzarella', 'skim milk ricotta cheese', 'white pepper', 'whitefish']","Bring large pot of salted water to a boil over high heat.Add the pasta and cook until tender but still firm to the bite, stirring occasionally, 10 minutes for me was PERFECT.Drain pasta and place each shell on slightly oiled cookie sheet/platter, do not lay on top of eachother, you do not want them to stick.In large bowl mix together your ricotta cheese, 3/4 cup of parmesan, egg yolk, basil, seafood, lemon zest, salt and pepper (mix well).Fill your noodles with about a tblspn of filling eachother.  Make sure to mold the mixture slightly so it is nice and compact (you do not want it to cook out of the noodles).Place each shell into a buttered/oiled baking pan (9X13).  If using Shell noodles place them so the open edge is facing up.Layer your Bchamel sauce evenly over the shells, and sprinkle with the remaining Parmesan and 1 cup of shredded Mozzarella.Bake until bubbly and the top is golden brown, about 20 minutes.Serve immediately.Bchamel SauceIn a medium sauce pan, melt the butter over medium heat.Add your minced garlic and lemon zest and let saute' for a couple minutes, do not let it burn.Add the flour and whisk until smooth, about 2 minutes.Gradually add the warmed half and half (warm the half and half in separate saucepan over low/med heat), whisking constantly until the sauce is thick, smooth, and creamy, about 10 minutes (do not allow the sauce to boil).Remove from heat, and stir in the salt, pepper, and nutmeg."
635712,Bouillabaisse: A Delicious Fisherman’s Stew Originating in France,45,4,https://spoonacular.com/recipeImages/635712-312x231.jpg,[],1,"{'scallops': '1.0 large', 'cod': '2.0 oz', 'halibut steak': '1.0 oz', 'littleneck clams': '3.0 ', 'shrimp': '2.0 large', 'clam juice': '0.25 T', 'yukon gold potatoes': '1.0 oz', 'tomatoes': '0.25 ', 'saffron threads': '0.25 pinch', 'white wine': '0.13 C', 'garlic cloves': '0.75 ', 'fennel bulb': '0.25 small', 'red onion': '0.25 ', 'olive oil': '0.5 T', 'sour cream': '0.06 C', 'mayonnaise': '0.06 C', 'garlic': '0.5 T', 'juice of lemon': '0.13 ', 'sweet paprika': '0.25 t', 'saffron': '0.25 pinch', 'cayenne pepper': '0.25 pinch', 'pepper': '0.25 serving', 'bread': '0.25 serving'}","['scallops', 'cod', 'halibut steak', 'littleneck clams', 'shrimp', 'clam juice', 'yukon gold potatoes', 'tomatoes', 'saffron threads', 'white wine', 'garlic cloves', 'fennel bulb', 'red onion', 'olive oil', 'sour cream', 'mayonnaise', 'garlic', 'juice of lemon', 'sweet paprika', 'saffron', 'cayenne pepper', 'pepper', 'bread']","In a small bowl, mix all ingredients together and let stand in refrigerator while cooking bouillabaisse.Remove from refrigerator and let warm to room temperature during last half hour of cooking."
654469,Pan-Roasted Swordfish with Chopped Tomatoes and Lemon Beurre Blanc,45,4,https://spoonacular.com/recipeImages/654469-312x231.jpg,[],1,"{'swordfish': '6.0 oz', 'tomatoes': '0.5 ', 'watercress': '0.25 ', 'olive oil': '0.25 T', 'shallots': '0.25 ', 'white wine': '0.13 cup', 'lemon juice': '0.5 tablespoons', 'lemon zest': '0.06 ', 'unsalted butter': '3.0 tablespoons', 'salt and pepper': '0.25 serving'}","['swordfish', 'tomatoes', 'watercress', 'olive oil', 'shallots', 'white wine', 'lemon juice', 'lemon zest', 'unsalted butter', 'salt and pepper']","Preheat oven to 400 degrees.Heat oil in heavy oven-proof skillet (cast iron is great for this). Cook swordfish 3 minutes until browed on one side, turn over and place in oven for about 10 minutes longer.While fish is in the oven, place watercress on plate.Prepare lemon beurre blanc"
640166,Cornmeal-Crusted Catfish with Cajun Seasoning and Spicy Tartar Sauce,45,4,https://spoonacular.com/recipeImages/640166-312x231.jpg,"['Creole', 'Cajun']",1,"{'egg': '0.25 large', 'milk': '0.25 tbsp', 'yellow cornmeal': '0.08 cup', 'chile powder': '0.25 tsp', 'cayenne': '0.13 tsp', 'smoked paprika': '0.13 tsp', 'granulated garlic': '0.13 tsp', 'catfish filets': '5.0 oz', 'olive oil': '0.75 tbsp', 'sea salt': '0.25 serving', 'bell pepper': '0.25 serving', 'light mayonnaise': '0.19 cup', 'dill pickle': '0.5 tbsp', 'jalapeno chile': '0.25 tbsp', 'scallion': '0.25 tbsp', 'dill pickle juice': '0.25 tsp', 'lemon juice': '0.25 tsp'}","['egg', 'milk', 'yellow cornmeal', 'chile powder', 'cayenne', 'smoked paprika', 'granulated garlic', 'catfish filets', 'olive oil', 'sea salt', 'bell pepper', 'light mayonnaise', 'dill pickle', 'jalapeno chile', 'scallion', 'dill pickle juice', 'lemon juice']","Whisk the egg and milk in a medium bowl.Combine the cornmeal, chile powder, cayenne powder, paprika, and garlic in a large zip-top bag.Dip each catfish filet in the egg mixture.Let excess egg drip off and place the filets in the bag with the cornmeal mixture. Zip the top and shake the bag until all pieces are well coated.Remove the filets and lay side by side on a plate (do not overlap).Place in the refrigerator for 30 minutes. (Refrigeration helps keep the crust adhered during cooking.)While the fish chills, make the sauce.Whisk the first 6 ingredients (through lemon juice) in a small bowl. Season with salt and pepper and set aside.Heat a large, nonstick skillet over medium heat and add the olive oil. When the oil is hot (but not smoking), season the catfish filets with salt and pepper and add to the skillet. Fry until crispy on the outside and tender on the inside, 3-4 minutes per side, depending on thickness.Divide the fish among 4 plates and top each with a dollop of tartar sauce or pass the sauce at the table."
657095,Prawn Curry,45,8,https://spoonacular.com/recipeImages/657095-312x231.jpg,"['Indian', 'Asian']",1,"{'basmati rice': '1.0 servings', 'cardamom pods': '0.38 ', 'cinnamon': '0.25 sticks', 'cumin': '0.13 teaspoon', 'ginger juice': '0.13 teaspoon', 'ground ancho chili': '0.13 tablespoon', 'ground coriander': '0.25 teaspoons', 'ground turmeric': '0.38 teaspoons', 'oil': '1.0 servings', 'onions': '0.13 cup', 'potatoes': '0.06 pound', 'prawns': '0.25 lbs', 'salt': '1.0 servings', 'sugar': '0.13 teaspoon', 'tomatoes': '0.25 ', 'yogurt': '0.5 ounces'}","['basmati rice', 'cardamom pods', 'cinnamon', 'cumin', 'ginger juice', 'ground ancho chili', 'ground coriander', 'ground turmeric', 'oil', 'onions', 'potatoes', 'prawns', 'salt', 'sugar', 'tomatoes', 'yogurt']","Shell, devein and wash prawns with salt water. Rub prawns with 2 teaspoons ground turmeric and 1 teaspoon salt. Set aside for 30 minutes.Skin and quarter large potatoes. Halve small ones. Rub with 1/2 teaspoon salt and 1 teaspoon ground turmeric. Fry in 2 ounces oil over medium heat until golden brown.Remove to a dish.In the same hot oil, fry cumin, cinnamon and cardamom for 1 minute, then add sliced onions and stir-fry for a further 5 minutes.Add prawns, ground chili, ground coriander, ground onions, ginger juice, yogurt, sugar and salt to taste. Stir to mix well.Add 3/4 pint boiling water and potatoes and cook until potatoes are tender and the gravy is very thick. Now add sliced tomatoes and remove from heat.Serve with rice.Serves 8."
663151,Thai Shrimp,45,4,https://spoonacular.com/recipeImages/663151-312x231.jpg,"['Thai', 'Asian']",1,"{'basil leaves': '0.25 bunch', 'chicken stock': '2.0 cups', 'cooked rice': '1.0 servings', 'fish sauce': '0.5 tablespoons', 'green onions': '1.0 ', 'peanut oil': '0.25 teaspoon', 'red chilies': '0.75 ', 'shrimp': '2.0 ounces', 'soy sauce': '0.5 teaspoons', 'sugar': '0.25 teaspoon'}","['basil leaves', 'chicken stock', 'cooked rice', 'fish sauce', 'green onions', 'peanut oil', 'red chilies', 'shrimp', 'soy sauce', 'sugar']","Peel and devein shrimp. Wash, dry and steam basil, mince garlic, thinly slice seeded chilies, mince white part of onion and cut green part into 1 inch pieces. Recipe can be prepared ahead to this stage.Heat wok over high heat. Swirl oil into wok and heat almost to smoking.Add garlic, chilies, onions (white part), and cook 10-15 seconds; add shrimp and stir fry 20 seconds or until they change color.Add fish sauce, soy sauce, sugar, chicken, stock and green part of onions and bring mixture to a boil. Stir in basil and cook 20 seconds or until leaves wilt and shrimp are firm and pink. Dish is supposed to be soupy.Serve over hot cooked rice."
640321,Crab Stacks,45,3,https://spoonacular.com/recipeImages/640321-312x231.jpg,[],1,"{'cooked crab': '0.33 ', 'quinoa': '0.33 cup', 'orange juice': '0.33 cup', 'chicken stock': '0.33 cup', 'mango': '0.33 ', 'chile': '0.33 ', 'avocado': '0.33 ', 'lime': '0.33 ', 'roma tomato': '0.33 ', 'cilantro': '0.33 tablespoon', 'green onion': '0.33 tablespoon', 'garlic clove': '0.33 ', 'salmon': '0.33 serving'}","['cooked crab', 'quinoa', 'orange juice', 'chicken stock', 'mango', 'chile', 'avocado', 'lime', 'roma tomato', 'cilantro', 'green onion', 'garlic clove', 'salmon']","COMBINE THE QUINOA, OJ AND STOCK IN A SAUCEPAN. COOK OVER MEDIUM HIGH HEAT UNTIL ALL LIQUID HAS BEEN ABSORBED. REMOVE FROM HEAT AND SET ASIDE.CUT THE LIME INTO QUARTERS.COMBINE THE MANGO AND FRESNO CHILE. SQUEEZE A 1/4 OF THE LIME OVER THE MIXTURE AND MIX TO COMBINE.COMBINE THE TOMATO, CILANTRO, GREEN ONION AND GARLIC. SQUEEZE 1/4 OF THE LIME OVER THE MIXTURE AND STIR TO COMBINE.USING A ROUND MOLD, SPOON SOME OF THE PREPARED QUINOA INTO THE BOTTOM. IF USING THE SALMON- SPOON IN A LAYER OF THE SALMON.- OTHERWISE USE CRAB. TOP WITH A LAYER OF THE TOMATO MIXTURE, THEN AVOCADO.TOP WITH A THIN LAYER OF THE QUINOA, THEN CRAB, FOLLOWED BY AVOCADO, THE MANGO MIXTURE AND MORE CRAB AND FINALLY TOPPED WITH A BIT MORE MANGO MIXTURE.PRESS DOWN AND THEN REMOVE THE MOLDS.GARNISH WITH PICKLED GINGER AND RADISHES AND USE THE REMAINING 1/2 LIME TO SQUEEZE OVER THE STACKS. SERVE COLD."
631751,Hot Crab Dip,45,4,https://spoonacular.com/recipeImages/631751-312x231.jpg,[],1,"{'cream cheese': '2.0 ounces', 'milk': '0.25 tablespoon', 'canned crabmeat': '0.25 can', 'onion': '0.5 tablespoons', 'horseradish': '0.13 teaspoon', 'breadcrumbs': '0.03 cup', 'butter': '0.5 tablespoons', 'salt': '0.25 serving'}","['cream cheese', 'milk', 'canned crabmeat', 'onion', 'horseradish', 'breadcrumbs', 'butter', 'salt']","Add all ingredients to softened cream cheese, mix with forkPlace in small casserole dishCover with breadcrumbs and butterBake 375 for 15 minutes"
640323,Crab Wontons,45,12,https://spoonacular.com/recipeImages/640323-312x231.jpg,"['Chinese', 'Asian']",1,"{'crabmeat': '0.08 can', 'cream cheese': '0.33 oz', 'reduced fat mayonnaise': '0.17 tablespoons', 'soy sauce': '0.02 tsp', 'garlic': '0.02 tsp', 'onion powder': '0.02 tsp', 'ground pepper': '0.08 serving', 'won ton wrappers': '1.0 '}","['crabmeat', 'cream cheese', 'reduced fat mayonnaise', 'soy sauce', 'garlic', 'onion powder', 'ground pepper', 'won ton wrappers']","Preheat oven to 350F. Spray a mini muffin tin with nonstick cooking spray.In a medium bowl, combine crab meat, cream cheese, mayonaise, soy sauce, garlic, onion powder,and pepper.Mix until well combined.Place 1 won ton wrapper in each 12 mini muffin cups. The edges of the won ton wrappers will extend beyond the mini muffin tin cups and may need to be folded slightly. Fill the center of each won ton cup with crab mixture.Bake 15 to 20 minutes or until edges of cups are golden brown and filling is heated through."
654566,Panko Shrimp,45,6,https://spoonacular.com/recipeImages/654566-312x231.jpg,[],1,"{'shrimp': '0.17 pound', 'panko': '0.33 cups', 'flour': '0.17 cup', 'eggs': '0.33 ', 'oil': '0.17 serving', 'lemon': '0.17 '}","['shrimp', 'panko', 'flour', 'eggs', 'oil', 'lemon']","Soy sauce for dippingPeel and devein shrimp,but leave tails attached.Wash well in salted water until water runs clear.This will be 5 or 6 changes of water.Dry on paper towels. Beat eggs in a bowl.Pour flour and panko onto separate pieces of waxed paper. Holding a shrimp by the tail,roll it in the flour,egg and panko.Place on cookie sheet.Repeat with remaining shrimp.This may be done several hours in advance,but keep them in the refrigerator.Heat oil in a pan to 350 degrees.Deep-fry shrimp until they turn light golden brown.You may need to do this in several batches,because if you crowd out the pan,they will not brown properly.Drain on paper towels.CutNote:The Japanese eat a lot of foods at room temperature and fried food coated with panko stays crisp for several hours,hence it is good picnic food.This dish is served as an appetizer course in a Japanese meal but would also make a good hors d'oeuvre at a Western-style party."
657090,Prawn Congee,45,2,https://spoonacular.com/recipeImages/657090-312x231.jpg,[],1,"{'ginger': '1.0 small', 'green onions': '1.0 stalks', 'mirin': '0.5 tablespoon', 'rice wine': '3.0 tablespoons', 'salt': '0.5 teaspoon', 'sesame oil': '0.5 Dash', 'soy sauce': '1.0 servings', 'tiger prawns': '5.0 ', 'water': '5.0 cups', 'bell pepper': '1.0 servings', 'white rice': '0.25 cup'}","['ginger', 'green onions', 'mirin', 'rice wine', 'salt', 'sesame oil', 'soy sauce', 'tiger prawns', 'water', 'bell pepper', 'white rice']","First, wash the rice accordingly and soak for at least 30 minutes - this step is to ensure a smoother consistency for the congee.Meanwhile, marinate the prawns.Boil the soaked rice together with the water/broth and unchopped ginger in a large pot, once brought to a boil, turn the heat lower to medium low and let boil until it reaches congee consistency. There is really no hard and fast rule for the consistency of the congee, it really depends on personal preferences, add more or less rice according to desire.Once you have achieved the consistency you desire, drop the marinated prawns in and watch closely.I only boiled the prawns for about 2-3 minutes to ensure that they didn't get overcooked - remember that the prawns will continue to 'cook' in the hot congee even after the heat is turned off.Ladle into individual bowls, and add as much green onions, ginger as you like - add dashes of soy, sesame oil and white pepper to your liking. Congee to me is best served piping, tongue-burningly hot!"
659907,Shrimp & Orzo,45,8,https://spoonacular.com/recipeImages/659907-312x231.jpg,[],1,"{'canned tomatoes': '3.5 oz', 'dry white wine': '0.09 c', 'fennel bulb': '0.13 ', 'feta cheese': '0.75 oz', 'fresh parsley': '0.25 T', 'garlic': '0.75 ', 'lemon wedges': '1.0 servings', 'low sodium chicken broth': '0.25 c', 'olive oil': '0.38 T', 'onion': '0.13 ', 'oregano': '0.5 t', 'orzo pasta': '0.13 lb', 'red pepper flakes': '0.09 t', 'Salt & Pepper': '1.0 servings', 'shrimp': '0.19 lb', 'water': '0.31 c'}","['canned tomatoes', 'dry white wine', 'fennel bulb', 'feta cheese', 'fresh parsley', 'garlic', 'lemon wedges', 'low sodium chicken broth', 'olive oil', 'onion', 'oregano', 'orzo pasta', 'red pepper flakes', 'Salt & Pepper', 'shrimp', 'water']","Preheat oven to 400 degrees f. Season the shrimp with salt &amp; pepper, refrigerate until ready to use. Grease a 13x9-inch baking dish.Heat the oil in a large Dutch oven over medium-high heat until the oil is shimmering.Add the onion, fennel bulb and 1/2 t. salt. Cook, stirring frequently until the vegetables are softened and starting to brown around the edges, about 10 minutes.Add the minced garlic and crushed red pepper flakes, cook and stir until the garlic becomes very fragrant, about 30 seconds.Add the orzo to the vegetables, stir to coat the orzo with oil, continue cooking, stirring fairly constantly, about 4 minutes, until the orzo has a toasty aroma.Add the wine, cook,stirring constantly, until the liquid evaporates, about 1 minute.Add the chicken broth, water and 1/4 t. salt. Bring to a boil, then reduce heat, simmer, until the orzo is almost completely tender, about 12 minutes, stirring fairly constantly to prevent sticking and adjusting the heat as necessary to maintain a lively simmer.After the 12 minutes, remove from heat and stir in the shrimp, tomatoes, oregano and 1 T. of the parsley.Transfer to the prepared baking dish, sprinkle with the feta.Bake for about 20 minutes, until the shrimp is cooked through and the feta is lightly browned. Before serving, sprinkle with the remaining parsley and the reserved fennel fronds.Serve with lemon wedges."
652753,Mussels Dijon,45,2,https://spoonacular.com/recipeImages/652753-312x231.jpg,[],0,"{'clam juice': '0.25 cup', 'dijon mustard': '0.5 tablespoon', 'garlic': '3.0 cloves', 'heavy cream': '0.25 cup', 'mussels': '1.0 ', 'olive oil': '0.5 tablespoon', 'onion': '0.13 cup', 'white wine': '0.5 cup'}","['clam juice', 'dijon mustard', 'garlic', 'heavy cream', 'mussels', 'olive oil', 'onion', 'white wine']","Debeard and scrub the mussels.Heat a large saute pan, place the oil in the pan, and saute the garlic and onions until soft. Deglaze the pan with the white wine over medium-high heat, add the mustard and stir to combine.Place the mussels, cream, and clam juice in the pan. Cover with a second pan (inverted) to create a steamer. Lower the heat slightly and steam for 5 minutes. The mussels are done when the shells open and the mussels are firm.Heap the mussels in a large bowl and pour the broth over them.Serve with crusty bread for dipping.This recipe yields 2 servings.Comments: The emphasis on gourmet cooking at the Vermont Inn is obvious.For a lighter version, skim milk may be used in place of the heavy cream."
644357,Garlic Shrimp,45,4,https://spoonacular.com/recipeImages/644357-312x231.jpg,[],1,"{'tiger prawns': '150.0 gr', 'olive oil': '0.25 ', 'garlic cloves': '1.5 large', 'shallot': '0.25 ', 'bay leaves': '0.25 leaves', 'sea-salt': '0.25 ', 'juice of lemon': '0.25 ', 'bell pepper': '0.25 serving'}","['tiger prawns', 'olive oil', 'garlic cloves', 'shallot', 'bay leaves', 'sea-salt', 'juice of lemon', 'bell pepper']","Heat the oil on a high heat and add the shallots, allow them to cook for about 30 seconds.Add the garlic and cook for a further 30 seconds.Add the prawns, cook for about one minute on each side.  They are cooked when they turn from black/grey to pink.  To make sure they are cooked through, you can either eat one (my preferred way to check!) or check the thickest part, the back area to make sure the pink colour goes all the way through.Squeeze the lemon juice into the pan to deglaze, mix through.Add the parsley, salt and pepper.  Check for seasoning and serve straight away.Tips and VariationsYou can add some fresh chili or some dried chili flakes if you want a bit of spice.Serve with pasta (I like spaghetti, spaghettini, linguini or fettuccine  as long as its a good quality pasta)Goes well with rice too."
633638,Baked Halibut,45,4,https://spoonacular.com/recipeImages/633638-312x231.jpg,[],1,"{'bread crumbs': '1.0 servings', 'butter': '0.5 sticks', 'halibut': '0.38 pounds', 'mayonnaise': '0.13 cup', 'onion': '1.0 servings', 'parsley flakes': '1.0 servings', 'bell pepper': '1.0 servings', 'salt': '1.0 servings', 'sour cream': '0.25 cup', 'white wine': '0.25 cup'}","['bread crumbs', 'butter', 'halibut', 'mayonnaise', 'onion', 'parsley flakes', 'bell pepper', 'salt', 'sour cream', 'white wine']",Marinate fish in white wine for 15-30 minutes.Drain on paper towel.Roll the fish in melted butter and then in bread crumbs and put in a baking pan.
641128,Curry Mussels,45,2,https://spoonacular.com/recipeImages/641128-312x231.jpg,"['Indian', 'Asian']",1,"{'mussels': '1.0 kg', 'onion': '0.5 ', 'dry white wine': '75.0 ml', 'crème fraîche': '75.0 ml', 'curry powder': '0.5 tablespoon', 'cayenne pepper': '0.5 teaspoon', 'parsley': '0.5 tablespoon', 'olive oil': '0.5 tablespoon', 'salt and pepper': '0.5 serving'}","['mussels', 'onion', 'dry white wine', 'crème fraîche', 'curry powder', 'cayenne pepper', 'parsley', 'olive oil', 'salt and pepper']","In a big pot or cocotte, put in olive oil and onion. Fry the onions until soft but not brown.Then, put in white wine, parseley, salt, pepper, and cayenne pepper.Stir for a few minutes before putting the mussels in the pot.Put the lid on and cook the mussels for about 2-3 minutes, shaking the pan occasionally.Use tongs to lift out the mussels as they open, putting them into a warm dish. Throw away any mussels that havent opened after 3 minutes.Strain the liquid through a fine sieve into a clean saucepan, leaving behind any grit or sand.Bring to the boil and  boil for 2 minutes.Add the curry powder and crme fraiche, stir. Reheat the sauce without boiling and let the sauce thicken.Serve the mussels in individual bowls with the sauce poured over.Sprinkle with some parsley."
645824,Grilled Prawns,45,4,https://spoonacular.com/recipeImages/645824-312x231.jpg,[],1,"{'bell pepper': '1.0 servings', 'garlic': '0.25 ', 'lime': '0.25 ', 'onion': '0.25 small', 'sea salt': '0.25 teaspoon', 'tiger prawns': '0.25 pound', 'vegetable oil': '0.25 teaspoon'}","['bell pepper', 'garlic', 'lime', 'onion', 'sea salt', 'tiger prawns', 'vegetable oil']","Mix the garlic and onion with the vegetable oil.Add the prawns and toss.Marinate in the refrigerator (at least 3 hrs).Grill the prawns on a barbecue or griddle for about 5 minutes, turning once.Mix together the salt, pepper and the juice from the lime to make a dip for the prawns."
633157,Avocado Shrimp,45,1,https://spoonacular.com/recipeImages/633157-312x231.jpg,[],1,"{'avocado': '1.0 ', 'chili sauce': '1.0 serving', 'mayonnaise': '1.0 serving', 'shrimp': '1.0 serving', 'sweet paprika': '1.0 serving'}","['avocado', 'chili sauce', 'mayonnaise', 'shrimp', 'sweet paprika']",Cut an avocado in half and remove pit. Thaw or cook shrimp.Drain shrimp well and put in avocado halves and arrange the rest around the avocados.Place a dollop of mayo on the plate.Place a splash of cocktail sauce on top of mayo.Sprinkle everything lightly with paprika.
