id,title,readyInMinutes,servings,image,cuisines,dish,ingredients,grocery,instructions
511748,Breakfast Tacos,45,2,https://spoonacular.com/recipeImages/511748-312x231.jpg,['Mexican'],0,"{'butter': '0.25 Tbsp', 'corn tortillas': '2.0 ', 'eggs': '1.5 large', 'red potato': '0.5 small', 'Salt & Pepper': '1.0 servings', 'shredded cheddar cheese': '1.0 tbsp'}","['butter', 'corn tortillas', 'eggs', 'red potato', 'Salt & Pepper', 'shredded cheddar cheese']","Cook potato in microwave. Slice and cut into thin strips.In a small saut pan heat butter over medium heat.Add potato to pan and lightly brown potato, season with salt and pepper.Add eggs to potato. Stir to scramble and combine.Wrap tortillas in a damp paper towel.Heat in microwave for about 45 seconds.Place equal amounts in each tortilla and top with shredded cheese."
636062,Breakfast Porridge,45,6,https://spoonacular.com/recipeImages/636062-312x231.jpg,[],0,"{'brown sugar': '0.04 cup', 'cinnamon': '0.08 teaspoon', 'dark molasses': '0.04 cup', 'eggs': '0.67 ', 'golden raisins': '0.04 pound', 'ground ginger': '0.08 tablespoon', 'lightly sweetened whipped cream': '1.0 servings', 'maple syrup': '0.5 tablespoons', 'milk': '0.17 tablespoon', 'nutmeg': '0.13 teaspoon', 'oatmeal': '0.33 cups', 'salt': '0.08 teaspoon', 'vanilla yogurt': '1.0 servings', 'walnuts': '0.04 cup', 'water': '0.33 tablespoons'}","['brown sugar', 'cinnamon', 'dark molasses', 'eggs', 'golden raisins', 'ground ginger', 'lightly sweetened whipped cream', 'maple syrup', 'milk', 'nutmeg', 'oatmeal', 'salt', 'vanilla yogurt', 'walnuts', 'water']","Heat water and salt until boiling.Add oatmeal and cook for 5 minutes. Cool.Combine next 10 ingredients and add to oatmeal.Pour into a greased 9-inch square baking pan and bake, uncovered, in preheated 350 degree oven for 2 hours.Serve hot topped with a dollop of whipped cream or vanilla yogurt.This recipe yields 6 servings."
636066,Breakfast Pretzels,45,100,https://spoonacular.com/recipeImages/636066-312x231.jpg,[],0,"{'active yeast': '0.01 ', 'cinnamon': '0.01 teaspoon', 'cream cheese': '0.01 cup', 'cup cake': '0.01 cup', 'egg white': '0.01 ', 'flour': '0.04 cups', 'milk': '0.01 cup', 'salt': '0.01 teaspoon', 'sugar': '0.02 tablespoons', 'vegetable oil': '0.05 tablespoons', 'water': '0.02 tablespoons'}","['active yeast', 'cinnamon', 'cream cheese', 'cup cake', 'egg white', 'flour', 'milk', 'salt', 'sugar', 'vegetable oil', 'water']","Place the blueberries, sugar and 1 tablespoon of vegetable oil in the bowl of a food processor, and pulse to make a thick paste. Grease a large baking sheet with 1 tablespoon of oil and set aside. Warm the milk in a small saucepan to 110 degrees, and set aside.Combine the yeast, 1 tablespoon of sugar, and 1 tablespoon of oil in the bowl of an electric mixer fitted with a dough hook.Add the milk to the bowl, and with the mixer on low speed, beat the mixture for 4 minutes to dissolve the yeast.Add the flour, salt, and blueberry paste to the bowl, and mix on low speed until the dough begins to come together. Increase the mixing speed to medium and beat until the dough pulls away from the sides of the bowl and forms a tight ball, about 2 minutes.Oil a large mixing bowl with 1 tablespoon of oil.Remove the dough from the mixer and place it in the oiled mixing bowl, turning to lightly coat with oil. Cover the bowl with plastic wrap or a damp kitchen towel, and set in a warm, draft-free place.Let the dough rise until doubled in size, about 2 hours.Remove the dough from the bowl and turn it onto a lightly floured surface.Roll the dough into a 12-inch by 10-inch rectangle.Cut the dough with a sharp knife into 18 pieces (about 1/4-cup each). Gently roll and pull each one into a long thin ribbon, about 1/2-inch in diameter and 14-inches in length. Bring the ends up to form a U-shape and twist to form a wreath, bringing the ends down and across as though making a bow, pressing down to seal the ends.Preheat oven to 400 degrees. Bring a large pot of water to a boil and add the pretzels in batches ofCook, turning once, about 2 minutes on each side.Remove from the water and drain on paper towels.Combine the beaten egg with 2 tablespoons of water.Brush the pretzels with the mixture and sprinkle with a combination of the remaining sugar and 1/2-teaspoon cinnamon.Place on the prepared baking pan and bake until golden brown, 20 to 25 minutes.Remove the pretzels from the oven, and serve warm with honeyed cream cheese.This recipe yields 18 servings."
636080,Breakfast Sticky Buns,45,8,https://spoonacular.com/recipeImages/636080-312x231.jpg,[],0,"{'brown sugar': '0.06 cup', 'butter': '0.13 tablespoon', 'butterscotch pudding': '0.13 box', 'pecans': '0.06 cup', 'sub rolls': '0.13 pkg'}","['brown sugar', 'butter', 'butterscotch pudding', 'pecans', 'sub rolls']",Spray a 10-inch tube pan with a no-stick cooking spray.Spread pecans evenly on bottom of pan.Place rolls on pecans and then sprinkle pudding on top of rolls.Mix sugar into melted butter.Pour this mixture over nuts/rolls/pudding. Cover and let stand overnight.Bake at 350 degrees for 20-25 minutes. Turn over and out onto plate at once.
636026,Breakfast Biscuits and Gravy,45,4,https://spoonacular.com/recipeImages/636026-312x231.jpg,['Southern'],0,"{'baking powder': '0.5 teaspoons', 'butter': '0.13 cup', 'flour': '0.75 tablespoons', 'fresh sage leaves': '0.5 teaspoons', 'ground allspice': '0.06 teaspoon', 'paprika': '0.13 teaspoon', 'pork sausage': '0.38 pounds', 'salt': '0.38 teaspoons', 'salt and pepper': '1.0 servings', 'unbleached flour': '0.44 cups', 'unsalted butter': '1.0 servings', 'whole milk': '1.0 cups', 'yogurt': '0.25 cup'}","['baking powder', 'butter', 'flour', 'fresh sage leaves', 'ground allspice', 'paprika', 'pork sausage', 'salt', 'salt and pepper', 'unbleached flour', 'unsalted butter', 'whole milk', 'yogurt']","Preheat the oven to 425F. Cover a baking sheet with a piece of parchment paper.Make the biscuits: sift the flour, baking powder, and salt together into a large bowl. Using two knives or a pastry blender, cut in the butter until the texture rangers from cornmeal to the size of small peas. (These two steps can be done quickly in a food processor.) Using a fork, gradually mix in the yogurt, then the milk, until the dough is quite soft and somewhat sticky. Work quickly without overworking the dough. Turn it out onto a lightly floured surface and knead it briefly, just long enough to get it to hold together.Roll it out so it is about 1 1/4 inches thick, and cut it into 2 iWhile the biscuits are baking, prepare the sausages: place all the sausage ingredients in a large bowl and mix thoroughly, using your fingers.To test the seasoning, fry a tiny patty and taste; adjust if necessary.Place the patties in a large heavy or nonstick skillet over medium-high heat, and cook until they are crisp and brown on the outside and cooked through inside, about 8 minutes per side.Transfer the sausage patties to a warmed platter and keep warm."
1096243,Prune Breakfast Bread,80,8,https://spoonacular.com/recipeImages/1096243-312x231.jpg,[],0,"{'prunes': '0.19 cups', 'flour': '0.25 cups', 'sugar': '0.09 cups', 'baking soda': '0.13 tsp', 'salt': '0.06 tsp', 'egg': '0.13 ', 'shortening': '0.25 tablespoons'}","['prunes', 'flour', 'sugar', 'baking soda', 'salt', 'egg', 'shortening']","In medium saucepan, combine pitted prunes with 1  cup water, bring to boiling.  Reduce heat, and simmer, covered.  10 minutes.Preheat oven 350 degrees.Sift flour with sugar, baking soda and salt; set aside.Drain prunes, reserving liquid.  Chop prunes or place in food processor and give a few good chops.Add to reserved liquid, and measure.Add water if needed to make 2 cups.In a large bowl combine egg and shortening:  with electric mixer at medium speed, beat well.Add prune mixture:  beat until well blended.Add flour mixture:  beat at low speed just until smooth.  Turn into prepared pan.Bake 50-60 minutes, or until cake tester inserted in center comes out clean.Let cool in pan on wire rack 10 minutes.Remove from pan:  cool completely on rack.  Wrap in plastic film or foil, and refrigerate overnight before slicing."
641185,Dad’s Breakfast Polenta,45,4,https://spoonacular.com/recipeImages/641185-312x231.jpg,[],0,"{'chicken stock': '0.75 cups', 'polenta': '0.25 cup', 'bacon': '1.0 pieces', 'green bell pepper': '0.13 ', 'green onions': '1.25 ', 'turkey sausage': '1.0 pieces', 'feta': '0.06 cup', 'salt': '0.25 serving', 'bell pepper': '0.25 serving'}","['chicken stock', 'polenta', 'bacon', 'green bell pepper', 'green onions', 'turkey sausage', 'feta', 'salt', 'bell pepper']","Prepare polenta according to package directions. (Be sure to season with some salt and pepper as well!)Meanwhile, cut bacon into small pieces and brown in a skillet with 1 tablespoon olive oil, on medium-high heat, until brown and crispy.Remove the bacon and reserve for later.Depending on your preference, you can either clean the pan and use 1 tablespoon olive oil, or you can cook the remaining veggies with a tablespoon of the bacon fat.)Add turkey sausage and bell pepper and saut until sausage is browned and cooked through.Add green onions, bacon, salt and pepper and saut for 5 more minutes.Add polenta to the meat and vegetables and stir to combine. Slowly stir in feta.Serve warm."
661984,Stuffed Breakfast Balls,45,6,https://spoonacular.com/recipeImages/661984-312x231.jpg,[],0,"{'basil': '0.33 tsp', 'coconut oil': '1.0 servings', 'eggs': '0.33 large', 'goat cheese': '1.0 servings', 'green bell pepper': '0.04 ', 'ground beef': '0.25 pounds', 'marjoram': '0.04 tsp', 'onion flakes': '0.17 tsp', 'red skinned potatoes': '0.83 ', 'sage': '0.17 tsp', 'sea salt': '0.17 tsp', 'tomato': '0.04 ', 'white pepper': '0.17 tsp'}","['basil', 'coconut oil', 'eggs', 'goat cheese', 'green bell pepper', 'ground beef', 'marjoram', 'onion flakes', 'red skinned potatoes', 'sage', 'sea salt', 'tomato', 'white pepper']","Shred 5 red skinned potatoes.Squeeze all liquid out of red skinned potatoes in papertowel.Place pan on med/high heat.Add a scoop of coconut oil to pan.Add shredded potatoes to pan.Spread them out and flip when crispy. Set potatoes aside.In another pan, add a scoop of coconut oil.Add 3 eggs. Scramble eggs until very close to done and remove from heat. Set aside.Chop green pepper and tomato. Set aside.Add ground beef to bowl.Add sage, sea salt, basil, white pepper, onion flakes and marjoram.Mix with hands thoroughly.Roll out parchment paper.Remove two small amounts of ground beef and roll into balls. Flatten balls onto parchment paper.Stack small scoop of hashbrowns, eggs, green peppers, tomato, slice of goat cheese.Place second ball on top of stack.Pinch edges together to seal.Pick up and begin forming into a ball in your hands releasing all of the air.Continue steps 9-13 until all ground beef is used. (Approx 6 Balls).Take paper towel and scoop small amount of coconut oil onto it. Wipe it all over flat pan.Place ground beef balls onto pan.Pre-heat oven to 35Bake 15 minutes or until ground beef is cooked through."
658134,Redneck Breakfast on a Croissant,45,1,https://spoonacular.com/recipeImages/658134-312x231.jpg,[],0,"{'croissant': '1.0 ', 'corned beef': '0.25 cup', 'egg': '1.0 ', 'butter': '0.5 teaspoon', 'kosher salt': '1.0 serving'}","['croissant', 'corned beef', 'egg', 'butter', 'kosher salt']","Split the croissant in half and toast.Heat a non stick pan over medium high heat, add the corned beef hash.  Cook the has until it is brown and crisp on one side (3 to 5 minutes), then flip with a turner and cook the other side until it is crisps and browns, another 3 to 5 minutes.  Note: While cooking the has push it together and flatten it so it makes a little patty, its much easier to flip and serve that way.Place the corned beef hash patty on the bottom half of the toasted croissant.In the same pan, melt the butter and add the egg, fry according to taste.Sprinkle the egg with a little salt and pepper and place on top of the corned beef hash patty.  On the top side of the croissant, squeeze a layer of canned cheese over it.Place the top layer over the bottom half.Serve immediately."
663853,Tropical Breakfast Quinoa,45,2,https://spoonacular.com/recipeImages/663853-312x231.jpg,[],0,"{'cooked quinoa': '0.5 cup', 'light coconut milk': '0.25 cup', 'pineapple': '1.5 tablespoons', 'cinnamon': '0.13 teaspoon', 'maple syrup': '0.5 teaspoon', 'coconut': '1.0 tablespoons', 'pecans': '2.5 ', 'strawberries': '0.25 cup', 'balsamic vinegar': '0.5 teaspoon'}","['cooked quinoa', 'light coconut milk', 'pineapple', 'cinnamon', 'maple syrup', 'coconut', 'pecans', 'strawberries', 'balsamic vinegar']","In a medium size pot combine cooked quinoa, coconut milk, crushed pineapple, cinnamon and maple syrup; stir to combine. Bring to a boil and reduce heat. Cook for 5 minutes, stirring occasionally.Top quinoa mixture with toasted coconut, pecans, sliced strawberries and balsamic vinegar."
1096256,Tiger Nut Breakfast Bars,160,6,https://spoonacular.com/recipeImages/1096256-312x231.jpg,[],0,"{'nuts': '0.43 oz', 'fruit': '0.7 oz', 'coconut flakes': '0.67 Tablespoons', 'coconut flour': '0.21 cups', 'honey': '0.58 Tablespoons', 'gelatin': '0.17 Tablespoon', 'coconut oil': '0.63 Tablespoons', 'water': '0.33 Tablespoon'}","['nuts', 'fruit', 'coconut flakes', 'coconut flour', 'honey', 'gelatin', 'coconut oil', 'water']","Preheat the oven to 280F (140C).Soak the tiger nuts in hot water for 20 minutes.Drain well and chop.Combine the tiger nuts, dried fruit, coconut flakes, and 3 tablespoons (21g) of the coconut flour.Add the honey and combine well.Spread the mixture evenly in an oven-safe dish and press down to compact.Bake for 1 hour and remove.Let the mixture cool then crumble in a food processor until coarse. If the pieces are too big, the mixture will fall apart  so this step is crucial!Sprinkle the gelatin over 1 tablespoon lukewarm water in a small bowl. Wait a minute or two, then add 1 tablespoon of hot water.Mix well until the gelatin is completely melted. Meanwhile, melt the coconut oil in the microwave.Add the coarse mixture and remaining coconut flour in a large bowl.Pour the gelatin and coconut oil over the mixture and mix until thoroughly combined.Line a baking dish with parchment paper and pour in the new mixture. Press down firmly.Bake in the oven for 1 hour, then remove and allow to cool before slicing into bars. Store in an airtight container."
1017374,Easy Weekday Breakfast Muffins,30,12,https://spoonacular.com/recipeImages/1017374-312x231.jpg,[],0,"{'bell pepper': '0.08 ', 'eggs': '1.0 ', 'milk': '0.04 cup', 'onion': '0.08 ', 'potato tots': '1.0 ', 'salt and pepper': '1.0 servings', 'shredded cheese': '0.08 cup', 'turkey': '0.04 cup'}","['bell pepper', 'eggs', 'milk', 'onion', 'potato tots', 'salt and pepper', 'shredded cheese', 'turkey']","Heat oven to 35Whisk eggs together in a medium bowl.Add chopped pepper and onion, salt and pepper, cheese, and milk. Fill muffin tin halfway with egg mixture.Sprinkle turkey meat into each.Add a potato tot to each. Top with cheese.Place in oven for 20 minutes or until fully cooked.Serve immediately or store for later."
715497,Berry Banana Breakfast Smoothie,5,1,https://spoonacular.com/recipeImages/715497-312x231.jpg,[],0,"{'banana': '0.25 cup', 'graham cracker crumbs': '2.0 tbsp', 'soy milk': '1.0 cup', 'strawberries': '0.5 cup', 'vanilla yogurt': '1.0 container'}","['banana', 'graham cracker crumbs', 'soy milk', 'strawberries', 'vanilla yogurt']","Take some yogurt in your favorite flavor and add 1 container to your blender.Add in the berries, banana, and soy milk and blend. Top your glass with a few graham cracker crumbs and serve."
634141,Banana Oatmeal Breakfast Muffins,45,12,https://spoonacular.com/recipeImages/634141-312x231.jpg,[],0,"{'oats': '0.17 cups', 'honey': '0.03 cup', 'bananas': '0.17 ', 'almond milk': '0.17 cups', 'egg whites': '0.04 cup', 'protein powder': '0.17 scoops', 'baking powder': '0.08 tsp', 'cinnamon': '0.17 tsp', 'coconut oil': '0.08 tsp', 'vanilla extract': '0.08 tsp', 'walnuts': '0.02 cup', 'raisins': '0.04 cup'}","['oats', 'honey', 'bananas', 'almond milk', 'egg whites', 'protein powder', 'baking powder', 'cinnamon', 'coconut oil', 'vanilla extract', 'walnuts', 'raisins']","In a small bowl mash bananas and add egg whites, vanilla and oil. Stir well.Dump into large bowl and add all remaining ingredients.Spray muffin pan with cooking spray and add oatmeal mixture evenly into each muffin cup.Bake on 350F for 35 minutes.Allow 5 minutes to cool."
636458,Bunny Eggs Kids Breakfast,45,6,https://spoonacular.com/recipeImages/636458-312x231.jpg,[],0,"{'bacon': '2.0 slices', 'blueberries': '2.0 ', 'eggs': '0.33 extra large', 'mild cheddar cheese': '0.33 large slices'}","['bacon', 'blueberries', 'eggs', 'mild cheddar cheese']","Cook bacon in large skillet until crisp.Remove bacon from skillet, reserving 1 tablespoon drippings in skillet.Drain bacon on paper towels.Add 3 eggs to reserved drippings; cover. Cook 4 to 6 minutes or until whites are opaque and completely set and yolks are beginning to thicken around edges.Remove eggs to individual serving plates; keep warm. Repeat with remaining eggs.For each bunny, place 2 bacon strips on egg for ears.Cut cheese strips in half to create whiskers; add blueberries for eyes."
647043,Homemade Muesli Breakfast Cereal,90,2,https://spoonacular.com/recipeImages/647043-312x231.jpg,[],0,"{'apple': '0.5 handful', 'bran flakes': '0.13 cup', 'cashews': '0.5 handful', 'craisins': '0.5 handful', 'honey': '0.5 tablespoon', 'olive oil': '0.5 tablespoon', 'rolled oats': '0.13 cup', 'sesame seeds': '0.5 teaspoon', 'wheat bran': '0.5 tablespoon', 'wheat germ': '0.5 tablespoon'}","['apple', 'bran flakes', 'cashews', 'craisins', 'honey', 'olive oil', 'rolled oats', 'sesame seeds', 'wheat bran', 'wheat germ']","Preheat the oven to 250 degrees F.Mix the olive oil and honey in a bowl and warm slightlyIn a oven-proof dish, mix all the other ingredients and pour in the warmed oil-honey mixture.Give it a brisk stir and pop into the oven for 30 minutes, stirring now and then.Remove from the oven and cool for an hour."
1096058,Sausage and Egg Breakfast Burrito,20,1,https://spoonacular.com/recipeImages/1096058-312x231.jpg,['Mexican'],0,"{'ground sausage': '0.25 lb', 'white onion': '0.25 cup', 'garlic': '3.0 cloves', 'peppers': '3.0 ', 'jalapeno': '0.5 ', 'kosher salt': '0.5 teaspoon', 'oregano': '0.5 teaspoon', 'ground pepper': '1.0 serving', 'flour tortilla': '1.0 large', 'egg': '1.0 large', 'butter': '1.0 tbsp', 'sriracha': '1.0 serving'}","['ground sausage', 'white onion', 'garlic', 'peppers', 'jalapeno', 'kosher salt', 'oregano', 'ground pepper', 'flour tortilla', 'egg', 'butter', 'sriracha']","Heat a pan to medium to high heat and add the sausage, diced onion, minced garlic, and julienned mini peppers. Break up sausage into small pieces as you cook it and the veggies, stirring often.After about 5 minutes, add the salt, oregano, and pepper and continue cooking for another 10-12 minutes until the sausage is completely cooked.In a separate small pan, heat to medium and add butter. Melt butter until it begins to sizzle a little add the egg.Let the egg cook, untouched for a couple of minutes. As the outside of the egg whites begins to set, cover the pan to let the top of the whites cook (by steaming the egg a bit), but keeping a nice runny yolk, 5-7 minutes.Lay tortilla flat and add sausage mixture. Top with the fried egg and sriracha.Wrap it up and dig in!"
1095895,Mini Quinoa Egg Breakfast Casserole,28,6,https://spoonacular.com/recipeImages/1095895-312x231.jpg,[],0,"{'eggs': '1.0 ', 'berries': '41.67 g', 'quinoa': '1.0 tablespoons', 'single cream cream': '0.04 cup', 'greek yogurt': '0.33 tbsp', 'sugar': '0.33 tablespoons', 'sea salt': '0.17 pinch', 'cinnamon': '1.0 servings', 'maple syrup': '1.0 servings'}","['eggs', 'berries', 'quinoa', 'single cream cream', 'greek yogurt', 'sugar', 'sea salt', 'cinnamon', 'maple syrup']","Preheat the oven to 375 F/ 190 C / gas mark 5.Beat the eggs, sugar and cream for 2-3 minutes.Add the cooked quinoa and stir well.  Fold in the berries. Spoon the mixture into 6 ramekins.Bake for 20-23 minutes.Sprinkle with cinnamon, drizzle with maple syrup  for extra sweetness if you like, and serve."
636199,Broccoli Oatmeal Breakfast Casserole,45,4,https://spoonacular.com/recipeImages/636199-312x231.jpg,[],0,"{'baking powder': '0.5 tsp', 'broccoli florets': '0.38 cups', 'cayenne pepper': '0.13 tsp', 'eggs': '1.0 large', 'milk': '0.75 tbsp', 'oats': '0.5 cups', 'olive oil': '0.25 tbsp', 'salt': '0.19 tsp'}","['baking powder', 'broccoli florets', 'cayenne pepper', 'eggs', 'milk', 'oats', 'olive oil', 'salt']",Preheat the oven at 350 degree Fahrenheit. Prepare 8 inch square baking dish with cooking spray.Grind the broccoli separately in a food processor and combine it with all the dry ingredients in a mixing bowl.In another bowl combine all the wet ingredients.Pour the wet ingredients into the dry ingredients and mix well.Spoon the batter into the baking dish and put it in the oven.Bake it for 25-30 minutes or until the fork comes out clean.Cut into desired size and serve hot.
640636,Creamy Egg Marinara Breakfast Dip,90,4,https://spoonacular.com/recipeImages/640636-312x231.jpg,[],0,"{'arugula': '0.5 cups', 'baguette': '0.25 ', 'basil': '0.06 cup', 'butter': '1.25 tablespoons', 'canned tomatoes': '7.0 ounce', 'crushed red pepper': '0.06 teaspoon', 'eggs': '1.75 ', 'garlic cloves': '0.5 ', 'olive oil': '0.06 cup', 'onion': '0.25 ', 'parmesan cheese': '0.5 tablespoons', 'rosemary': '0.25 small sprig', 'salt and pepper': '1.0 servings', 'thyme': '0.5 sprigs'}","['arugula', 'baguette', 'basil', 'butter', 'canned tomatoes', 'crushed red pepper', 'eggs', 'garlic cloves', 'olive oil', 'onion', 'parmesan cheese', 'rosemary', 'salt and pepper', 'thyme']","Place tomatoes, butter, onion, rosemary, thyme, and salt in a saucepan over medium heat.Bring to simmer.Reduce heat to low and continue simmering for 45 minutes.Stir occasionally.Remove from heat and take out the onion, and sprigs of rosemary and thyme.Seth doesnt like chunks of tomato, so we use an immersion blender to puree the sauce."
662515,Sweet Florida Orange Breakfast Bread,45,16,https://spoonacular.com/recipeImages/662515-312x231.jpg,[],0,"{'flour': '0.19 cups', 'baking powder': '0.03 teaspoon', 'baking soda': '0.03 teaspoon', 'salt': '0.03 teaspoon', 'buttermilk': '0.05 cup', 'orange juice': '0.03 cup', 'vanilla extract': '0.13 teaspoons', 'unsalted butter': '0.03 pound', 'sugar': '0.13 cups', 'eggs': '0.25 ', 'orange zest': '0.02 cup', 'brown sugar': '0.03 cup', 'oranges': '0.06 small'}","['flour', 'baking powder', 'baking soda', 'salt', 'buttermilk', 'orange juice', 'vanilla extract', 'unsalted butter', 'sugar', 'eggs', 'orange zest', 'brown sugar', 'oranges']","Preheat oven to 350F.Grease and lightly flour loaf pans.In a medium bowl, whisk together flour, baking powder, baking soda, and salt. Set aside.Measure buttermilk, orange juice, and vanilla into a measuring cup. Set aside.In a large bowl, use a mixer to beat the butter until creamy.Blend in sugar and beat for a few minutes until light and fluffy.Mix in eggs, one at a time, and orange zest, and beat until well incorporated.With mixer on low, slowly pour in 1/3 of the flour mixture.Mix in half of the buttermilk mixture.Blend in another 1/3 of the flour mixture and remaining buttermilk mixture.Add remaining flour mixture and mix until just blended.Divide batter between prepared pans, filling about 3/4 full, and bake for 30 to 35 minutes (45 minutes if using a large loaf pan) or until a toothpick inserted in center comes out clean.While loaves bake, prepare orange simple syrup.Stir together 1/2 cup orange juice and 1/2 cup brown sugar in a small pot. Bring to a boil over medium heat while occasionally stirring, then reduce heat and simmer for a few minutes.Remove pot from heat and set aside to cool.When cakes are done, cool for 10 minutes before turning out onto wire rack. Set rack over a sheet pan or piece of foil, and using a brush or a spoon, soak each cake with simple syrup. Allow to cool completely.Store in an airtight container or wrap tightly."
633219,Baby Blake’s Oatmeal Breakfast Cookies,45,32,https://spoonacular.com/recipeImages/633219-312x231.jpg,[],0,"{'flour': '0.03 cup', 'whole wheat flour': '0.03 cup', 'quick cooking oats': '0.09 cups', 'baking powder': '0.03 teaspoon', 'salt': '0.02 teaspoon', 'cinnamon': '0.03 teaspoon', 'raw sugar': '0.03 cup', 'egg': '0.03 large', 'egg white': '0.03 large', 'vanilla': '0.06 teaspoons', 'molasses': '0.06 tablespoons', 'store-bought phyllo': '0.03 cup', 'canola oil': '0.01 cup', 'raisins': '0.03 cup', 'apples': '0.03 cup'}","['flour', 'whole wheat flour', 'quick cooking oats', 'baking powder', 'salt', 'cinnamon', 'raw sugar', 'egg', 'egg white', 'vanilla', 'molasses', 'store-bought phyllo', 'canola oil', 'raisins', 'apples']",Preheat the oven to 350 and spray a non-stick cookie sheet with cooking spray.Mix dry ingredients including sugar in a large bowlMake a well in the center of the dry ingredients and add the remaining ingredients EXCEPT raisins and apples.Mix the wet and dry ingredients together until well blended. Fold in raisins and apples.Drop by large tablespoonfuls onto the cookie sheet 2 apart.Bake 8  10 minutes until cookies are nicely browned and cooked through.
