id,title,readyInMinutes,servings,image,cuisines,dish,ingredients,grocery,instructions
1095931,Matcha Smoothie,2,1,https://spoonacular.com/recipeImages/1095931-312x231.jpg,[],0,"{'banana': '0.5 ', 'low fat vanilla greek yogurt': '6.0 ounce', 'matcha powder': '1.0 teaspoon', 'almond butter': '1.5 tablespoons', 'date': '1.0 ', 'almond milk': '0.5 cup', 'ice': '1.0 cup'}","['banana', 'low fat vanilla greek yogurt', 'matcha powder', 'almond butter', 'date', 'almond milk', 'ice']","Add the banana, yogurt, matcha powder, almond butter, date, almond milk and ice to a blender. Blend on high for 1 minute.Serve immediately."
636392,Buckwheat Crepes,45,1,https://spoonacular.com/recipeImages/636392-312x231.jpg,"['Mediterranean', 'French', 'European']",0,"{'water': '0.75 cup', 'coconut oil': '2.0 teaspoons', 'buckwheat flour': '0.5 cup', 'egg': '1.0 ', 'salt': '0.13 teaspoon', 'honey': '2.0 teaspoons', 'cinnamon': '0.25 teaspoon'}","['water', 'coconut oil', 'buckwheat flour', 'egg', 'salt', 'honey', 'cinnamon']","Combine kefir (or other), oil and grain in the blender. Blend for about 3 minutes on high or just 30 seconds if using flour. Cover blender and let batter stand overnight at room temp to break down the phytates. After soaking, add egg, salt, honey & cinnamon (if making sweet style). Blend till well mixed.Rub your cast iron pan with oil and get it nicely hot, but not smokey. Have a napkin ready for rubbing more in between crepes.Pour about 1/4 cup of batter into the hot pan and quickly tilt the pan to spread the batter evenly to the edges.Mix your batter each time before making each new crepe. Cook till edges are browned and loosen along the edges with a thin table knife or spatula. Turn over crepe and cook for about 30 seconds. Turn over onto a plate and keep it warm with a light towel covering it. Rub more oil on pan and continue till batter is used up.Top with Creamy Honey Cheese, your choice of fruit and syrup. For the blackberry syrup... I cooked the berries with a little water till they were mush, added arrowroot powder and boiled it gently till it thicken. Then I added honey and pour the mixture in my blender. Gave it a whirl till smooth and poured into a jar to serve. Simple, tart and sweet!"
1096269,Tigernut Granola,10,4,https://spoonacular.com/recipeImages/1096269-312x231.jpg,[],0,"{'coconut flakes': '0.25 oz', 'dried mixed fruit': '0.5 oz', 'honey': '0.25 Tablespoon'}","['coconut flakes', 'dried mixed fruit', 'honey']","Preheat the oven to 350F / 180C.Combine the tigernuts, coconut flakes, dried fruit, and honey together in a bowl.Mix until well coated.Spread out in an even layer on a large roasting tray and place in the oven for 6-7 minutes.Remove the tray from the oven set aside to cool completely.Store in a sealed container."
1095797,Lemon Rum Crêpes,40,6,https://spoonacular.com/recipeImages/1095797-312x231.jpg,"['Mediterranean', 'French', 'European']",0,"{'eggs': '0.33 ', 'water': '0.33 cups', 'rum': '0.17 Tbs', 'vanilla extract': '0.17 tsp', 'sugar': '0.33 Tbs', 'salt': '0.06 tsp', 'flour': '0.33 cups', 'butter': '1.33 Tbs', 'lemon zest': '0.33 '}","['eggs', 'water', 'rum', 'vanilla extract', 'sugar', 'salt', 'flour', 'butter', 'lemon zest']","For the batter, whisk together the eggs, water, rum, vanilla, sugar and salt in a large bowl, until well blended.Sift the flour, a bit at a time, whisking each addition until smooth.Add in half the melted butter and the lemon zest, whisking until the batter has slightly thickened, with the consistency of melted ice cream.Put the remaining butter in a small cup and keep it warm.Heat the crepe pan or a nonstick skillet over medium heat until quite hot. Lightly brush with melted butter. Ladle in a scant  cup of batter, tilt and swirl so it coats the bottom. Lower the heat and cook the pancake until underside is golden brown, 2 to 3 minutes. Flip it over with a spatula and fry for a half minute or longer, until the second side is lightly browned. Slide the crepe out of skillet and repeat with the remaining batter. (Coat pan with butter as needed.)Fold the crepes and squeeze some lemon juice over them, sprinkle with granulated sugar or cinnamon or spread with a filling of your choice."
639120,Chocolate Oatmeal,45,4,https://spoonacular.com/recipeImages/639120-312x231.jpg,[],0,"{'rolled oats': '0.38 cups', 'vanilla sugar': '0.06 cup', 'cocoa powder': '0.06 cup', 'water': '0.44 cups', 'sea salt': '0.25 pinches', 'milk': '0.13 cup'}","['rolled oats', 'vanilla sugar', 'cocoa powder', 'water', 'sea salt', 'milk']","In a medium pot, bring water to a boil.Add Vanilla Sugar and Cocoa Powder.Stir in Oats and Sea Salt.Reduce heat to low and simmer until the oats are tender, ~5 minutes.Remove from heat and stir in milk.Serve with Extra milk, Sea Salt or Vanilla Sugar for garnish, as needed."
650650,Make Ahead Quiche,45,8,https://spoonacular.com/recipeImages/650650-312x231.jpg,"['Mediterranean', 'French', 'European']",0,"{'unbaked pie crust': '0.13 9-inch', 'shredded cheddar cheese': '0.13 cup', 'jack cheese': '0.13 cup', 'flour': '0.13 tablespoon', 'diced ham': '0.06 cup', 'eggs': '0.5 ', 'half and half': '0.13 cup', 'green onions': '0.25 ', 'salt': '0.03 teaspoon', 'ground mustard': '0.03 teaspoon', 'pepper': '0.13 Dash'}","['unbaked pie crust', 'shredded cheddar cheese', 'jack cheese', 'flour', 'diced ham', 'eggs', 'half and half', 'green onions', 'salt', 'ground mustard', 'pepper']","In a medium bowl, toss the flour with the grated cheese.  Evenly spread the cheese over the bottom of the pie crust.  Top the cheese with the diced ham.  In a medium bowl, whisk together eggs, half and half, salt, pepper and dry mustard.  Stir in the green onions.Pour the egg mixture over the ham and cheese.Cover the unbaked quiche with plastic wrap, then with foil, sealing the edges well.Place the prepared quiche in the freezer.  When ready to bake, preheat the oven to 400 degrees.  Do not thaw the quiche!Remove the foil and plastic wrap.Place the foil around the edges of the crust to prevent burning.Place the frozen quiche in the oven and bake for about 1 hour, or until the filling is set and the crust is golden brown.To cook the quiche immediately (without freezing first), preheat the oven to 350 degrees and bake for 45 minutes to 1 hour."
1646939,Strawberry Scones,45,8,https://spoonacular.com/recipeImages/1646939-312x231.jpg,"['English', 'Scottish', 'British', 'European']",0,"{'flour': '0.25 cup', 'sugar': '0.04 cup', 'baking powder': '0.25 tsp', 'salt': '0.03 tsp', 'egg': '0.13 large', 'heavy cream': '0.03 cup', 'buttermilk': '0.03 cup', 'vanilla extract': '0.13 tsp', 'butter': '0.75 Tbsp', 'strawberries': '0.13 cup', 'sparkling sugar': '1.0 tsp'}","['flour', 'sugar', 'baking powder', 'salt', 'egg', 'heavy cream', 'buttermilk', 'vanilla extract', 'butter', 'strawberries', 'sparkling sugar']","Preheat oven to 375 degrees. Line a baking sheet with silpat or parchment paper.In a large mixing combine flour sugar, baking powder, and salt with a whisk; set aside.In a small bowl beat egg.Add heavy cream, buttermilk, and vanilla; whisk to combine.Add butter to the flour mixture. Using your fingers rub the butter into the flour for form a coarse meal.Add milk mixture to flour. Stir with a fork to combine batter into a loose dough.Gently stir in the strawberries.Transfer dough onto a lightly flour counter top. Gently press dough together to form a 8 inch circle about 1 inch thick.Cut into 8 wedges.Place on baking sheet.Sprinkle each scone with 1 tsp of sugar.Bake for 12-15 minutes or until lightly browned."
658300,Rich Jelly Scones,45,4,https://spoonacular.com/recipeImages/658300-312x231.jpg,"['English', 'Scottish', 'British', 'European']",0,"{'all purpose flour': '0.5 cups', 'granulated sugar': '0.06 cup', 'baking powder': '0.5 teaspoons', 'baking soda': '0.06 teaspoon', 'salt': '0.06 teaspoon', 'unsalted butter': '0.13 cup', 'eggs': '0.5 ', 'milk': '0.25 tablespoon', 'vanilla extract': '0.38 teaspoons', 'fruit': '0.25 serving', 'egg': '0.25 large'}","['all purpose flour', 'granulated sugar', 'baking powder', 'baking soda', 'salt', 'unsalted butter', 'eggs', 'milk', 'vanilla extract', 'fruit', 'egg']","Pre-heat oven to 400 degrees.Mix dry ingredients together.Cut butter into the dry ingredients using a fork or hand-held pastry blender. When well blended, the mixture will have the look of crumbly sand.Add the vanilla, eggs, and milk, mixing only long enough to blend the ingredients. *You do not want to begin to melt the butter into the flour mixture by over-mixing.Turn the dough onto a lightly floured counter top or pastry board. Shape it into a round disc 8 inches across, slightly thicker in the center.Using a long knife, cut the dough into eight even pie-shaped portions.Place scones on a lightly greased baking sheet. Using a spoon, press a well into the wide end of each triangle, and fill the well with a spoonful of fruit jam.Brush the exposed surface of each scone with the milk/egg mixture,Bake for twenty-five minutes, until scones are a beautiful golden brown."
1095748,Vegan French Toast,45,2,https://spoonacular.com/recipeImages/1095748-312x231.jpg,['American'],0,"{'almond milk': '0.5 cup', 'vanilla extract': '0.25 tsp', 'ground cinnamon': '0.25 tsp', 'maple syrup': '1.0 servings', 'ground chia seeds': '0.5 tbsp', 'bread': '2.5 Slices', 'banana': '0.5 ', 'brown sugar': '1.0 tbsp', 'coconut oil': '1.0 tbsp', 'berries': '0.5 cup', 'almonds': '0.13 cup'}","['almond milk', 'vanilla extract', 'ground cinnamon', 'maple syrup', 'ground chia seeds', 'bread', 'banana', 'brown sugar', 'coconut oil', 'berries', 'almonds']","Grind up the chia seeds into a powder, I used the milling blade on my nutri bullet for this. It is not essential to grind them, it just means you won't have any whole seeds in the final product.Mix all the ingredients for the french toast (except the bread) in a large bowl and place in the fridge for 10-20 minutes. This will allow the chia seeds time to thicken the mixture and give it that ""eggy"" texture.Heat a tablespoon of coconut oil in a large frying pan on a medium/high heat. Dip each slice of bread into the mixture, giving it around 20 seconds on each side in the mixture. Fry for 3-4 minutes on each side until golden brown.Meanwhile, in another frying pan, make the bananas. Slice the ripe banana in half lengthways.Place the brown sugar and vegan butter (or coconut oil) in the frying pan and melt until the sugar has dissolved.Add the banana and coat in the caramel, let bubble away for around 5 minutes until the banana is soft.Serve the banana on top of the french toast and use any leftover sauce to drizzle over the top.Add some berries, flaked almonds and if you want, a little extra maple syrup.Serve immediately."
643514,Fresh Herb Omelette,45,1,https://spoonacular.com/recipeImages/643514-312x231.jpg,[],0,"{'eggs': '2.0 ', 'black pepper': '0.25 teaspoon', 'green onion': '0.13 cup', 'cherry tomatoes': '4.0 ', 'fresh basil': '1.0 sprig', 'parmesan cheese': '0.13 cup', 'olive oil': '1.0 serving'}","['eggs', 'black pepper', 'green onion', 'cherry tomatoes', 'fresh basil', 'parmesan cheese', 'olive oil']",Stir your eggs together in a bowl with the pepper making sure to break the yolks.Heat a pan to medium-high and pour enough olive oil to cover the bottom of the pan.Pour your egg into the pan. Cook for 1-2 minutes or until the egg stops bubbling and begins to solidify.Flip the egg over and heat the other side until it is cooked through.Place on your plate.Add your toppings and enjoy!
643450,Fresh Cherry Scones,45,8,https://spoonacular.com/recipeImages/643450-312x231.jpg,"['English', 'Scottish', 'British', 'European']",0,"{'cherries': '0.13 cup', 'oat flour': '0.25 cups', 'cornmeal': '0.13 cup', 'baking powder': '0.25 teaspoons', 'baking soda': '0.06 teaspoon', 'salt': '0.06 teaspoon', 'ground nutmeg': '0.13 teaspoon', 'ground ginger': '0.25 teaspoons', 'walnuts': '0.06 cup', 'agave nectar': '0.04 cup', 'unsweetened applesauce': '0.09 cup', 'plain yogurt': '0.03 cup', 'vanilla extract': '0.25 teaspoons'}","['cherries', 'oat flour', 'cornmeal', 'baking powder', 'baking soda', 'salt', 'ground nutmeg', 'ground ginger', 'walnuts', 'agave nectar', 'unsweetened applesauce', 'plain yogurt', 'vanilla extract']","Cut cherries in half and pit them (or use a cherry pitter).Place the cherries in a freezer-safe container and freeze for at least 3 hours prior to baking the scones. This ensures the cherries dont pop in the dough while theyre baking.In a KitchenAid (with the wire whisk attachment) or food processor, add the oat flour, cornmeal, baking powder, baking soda, nutmeg, ginger and salt.Mix or pulse to combine dry ingredients. In a bowl, combine the applesauce, yogurt, vanilla extract and agave nectar.  Stir to combine Very slowly pour the wet ingredients into the mixer with the dry ingredients about a quarter of a cup at a time (similar idea to making pie crust), mixing on medium speed. Once all the wet ingredients are combined with the dry, add chopped walnuts and mix until integrated into the dough. Taking the dough in your hands, form it into a disc shape. Refrigerate in a sealable container or plastic wrap for 1 hour.Preheat the oven to 375 degrees. Using a bread knife, cut the dough in half horizontally like you would a bun.Place half of the frozen cherries on one of the dough halves then place the other half of the dough on top. Press the dough halves together to seal the cherries in.  Press the remaining frozen cherries into the top of the dough. Using a serrated knife, cut diagonals into the dough in order to create eight triangles. Arrange on a parchment paper-lined baking sheet (be sure to give the triangles enough space to bake evenly).Bake for 23 minutes or until the tops of the scones are golden brown.Serve with butter, jam, honey, or nutella."
1096257,Gluten Free Waffles,30,2,https://spoonacular.com/recipeImages/1096257-312x231.jpg,[],0,"{'gelatin': '1.0 teaspoons', 'water': '0.17 cup', 'cassava flour': '0.5 cup', 'coconut flour': '2.75 tablespoons', 'cream of tartar': '0.25 teaspoon', 'baking soda': '0.25 teaspoon', 'salt': '0.5 pinch', 'coconut oil': '0.75 tablespoons', 'honey': '1.0 tablespoons', 'blueberries': '1.0 servings'}","['gelatin', 'water', 'cassava flour', 'coconut flour', 'cream of tartar', 'baking soda', 'salt', 'coconut oil', 'honey', 'blueberries']","Put 2 tablespoons of hot water in a small bowl and sprinkle the gelatin over the water. Set aside.Weigh out the solid coconut oil, then melt in a microwave.Heat a greased waffle maker.Combine the cassava flour, coconut flour, salt, cream of tartar, and baking soda in a bowl.Add the melted coconut oil, gelatin mixture, and honey to the bowl.Add the remaining hot water, stirring continuously, until you achieve a thick slurry consistency.Pour the batter into the waffle maker, cooking until crispy and holding its shape.Remove carefully and serve with a drizzle of honey and some blueberries, if desired."
644860,Gluten Free Waffles,45,8,https://spoonacular.com/recipeImages/644860-312x231.jpg,[],0,"{'baking powder': '0.38 teaspoons', 'pink himalayan salt': '0.06 tsp', 'brown rice': '0.13 cup', 'potato starch': '0.06 cup', 'tapioca flour': '0.03 cup', 'coconut oil': '0.06 cup', 'coconut milk': '0.19 cup', 'honey': '0.25 tsp', 'baking soda': '0.06 teaspoon', 'eggs': '0.38 '}","['baking powder', 'pink himalayan salt', 'brown rice', 'potato starch', 'tapioca flour', 'coconut oil', 'coconut milk', 'honey', 'baking soda', 'eggs']","Mix all dry ingredients in a large bowl, and slowly mix in wet ingredients. Cook on low in waffle machine."
636962,Caprese Quick Bread,45,12,https://spoonacular.com/recipeImages/636962-312x231.jpg,[],0,"{'flour': '0.06 cups', 'white whole wheat flour': '0.06 cups', 'baking powder': '0.08 Tablespoon', 'salt': '0.04 teaspoons', 'dried basil': '0.08 Tablespoon', 'mozzarella cheese': '0.33 ounces', 'olive oil': '0.08 Tablespoon', 'whole egg': '0.08 ', 'non-fat milk': '0.08 cup', 'sundried tomatoes': '0.02 cups', 'butter': '0.06 Tablespoons'}","['flour', 'white whole wheat flour', 'baking powder', 'salt', 'dried basil', 'mozzarella cheese', 'olive oil', 'whole egg', 'non-fat milk', 'sundried tomatoes', 'butter']","Heat oven to 35Spray a 9x5x3 loaf pan or two mini bread pans with cooking spray.Stir together flours,cheese, baking powder, basil and salt in medium bowl.Add olive oil, egg and milk, stir till combined. Fold in sundried tomatoes.Pour into pan, drizzle melted butter over top of bread. (Bread will be thick, flatten it out with your fingers)Bake 30 minutes for mini loaf pans and 40  50 minutes for large loaf pan, or until golden brown and toothpick inserted in center comes out clean. Cool 5 minutes, remove from pan to wire rack. Cool 30 minutes before slicing, if you can control yourself!"
637184,Carrot Cake Pancakes,45,12,https://spoonacular.com/recipeImages/637184-312x231.jpg,[],0,"{'carrots': '0.08 cup', 'white whole wheat flour': '0.13 cups', 'baking powder': '0.08 tablespoon', 'salt': '0.04 teaspoon', 'cinnamon': '0.08 teaspoon', 'ground nutmeg': '0.02 teaspoon', 'ground allspice': '0.08 pinch', 'butter': '0.33 tablespoons', 'egg': '0.08 ', 'milk': '0.13 cups', 'turbinado': '0.25 tablespoons', 'vanilla extract': '0.08 teaspoon', 'raisins': '0.04 cup'}","['carrots', 'white whole wheat flour', 'baking powder', 'salt', 'cinnamon', 'ground nutmeg', 'ground allspice', 'butter', 'egg', 'milk', 'turbinado', 'vanilla extract', 'raisins']","Peel and grate the carrots. If you end up having more than 1 cup of grated carrots from the 3-4 medium carrots, thats OK, this recipe can easily handle up to 1.5 cups of grated carrots.Microwave the grated carrots for 3 minutes on medium, or until the carrots are soft and partially cooked.Mix together the dry ingredients in a large bowl  flour, baking powder, salt, and spices.Whisk together the wet ingredients in a bowl until well combined  melted butter, sugar, egg, milk, and vanilla extract.Add the wet ingredients to the dry ingredients and whisk together until almost combined.Add the grated carrots and raisins/walnuts if youre using those. Stir until everything is combined, but do not overmix!Heat some oil or butter in a skillet. Use heaping tablespoons (or an ice cream scoop!) to add the pancake batter to the pan. Cook about 2-3 minutes on medium/low heat, or until little bubbles start forming at the surface. Flip each pancake, and cook about 2-3 minutes on the other side, or until the inside is fully cooked.Serve warm with butter, syrup, powdered sugar  whatever you want!"
650239,Loaded Veggie Omelet,45,2,https://spoonacular.com/recipeImages/650239-312x231.jpg,[],0,"{'shallot': '0.5 small', 'garlic': '0.5 teaspoon', 'mushrooms': '2.0 ', 'cherry tomatoes': '4.0 ', 'fresh basil': '0.5 tablespoon', 'spinach': '0.25 cup', 'eggs': '2.0 ', 'cheese': '0.25 cup', 'olive oil': '0.5 serving'}","['shallot', 'garlic', 'mushrooms', 'cherry tomatoes', 'fresh basil', 'spinach', 'eggs', 'cheese', 'olive oil']","Preheat the oven to warm or 170 degrees. Bring a small saute pan or small omelet pan to a warm.Saute the veggies using the olive oil starting with the shallot and garlic, adding the mushrooms until they are tender. Toss in the tomatoes and spinach and remove the pan from the heat.Pour a layer of the egg into a small omelet pan or small saute pan. As the egg starts to cook run a spatula around the edge to loosen the egg. Once the egg is almost cooked (slightly runny on the top) sprinkle half the basil, cheese, and sauteed veggies on to one side of the egg. Gently fold the egg over the filling.Slide the omelet onto a small oven safe plate and put it in the oven.Repeat for the second omelet!"
633970,Banana & Oreo Muffin,45,4,https://spoonacular.com/recipeImages/633970-312x231.jpg,['Southern'],0,"{'butter': '27.5 grams', 'sugar': '0.13 Cup', 'flour': '0.25 cup', 'baking powder': '0.13 teaspoon', 'baking soda': '0.13 teaspoon', 'egg': '0.5 ', 'condensed milk': '0.5 tablespoons', 'banana': '0.06 teaspoon', 'oreo cookies': '2.0 pieces', 'vanilla essence': '0.13 teaspoon'}","['butter', 'sugar', 'flour', 'baking powder', 'baking soda', 'egg', 'condensed milk', 'banana', 'oreo cookies', 'vanilla essence']","Sift the flour, baking power and baking soda together and set aside.Remove the cream from the cookies, place the cookies in a ziplock bag, use a rolling pin, crush the cookie into fine crumbs.Cream butter and sugar with electric beater till light and fluffy(about 3 minutes on medium speed).Add in egg one at a time and beat till the mixture is well combine without any egg trace.Add mashed banana, vanilla essence and condensed milk into the butter mixture and give it a quick whisk.Lower the mixer speed, add flour mixture and blend the mixture till smooth.Stir in the oreo cookies crumbs till combined, scoop the mixture into prepared muffin cups to 3/4 full.Top the muffin batter with some extra banana slices and oreo cookies, bake them in preheated 180 degree oven for about 20 - 25 minutes or till a toothpick inserted in the center and comes out clean."
1096166,Leek And Pea Frittata,40,4,https://spoonacular.com/recipeImages/1096166-312x231.jpg,[],0,"{'leek': '1.75 oz', 'peas': '1.33 oz', 'parsley': '0.25 large bunch', 'fresh thyme': '0.75 sprigs', 'fresh basil': '0.25 handful', 'fresh sage': '0.25 handful', 'eggs': '2.0 ', 'parmesan': '1.0 tablespoons', 'nutmeg': '0.25 dash', 'salt and pepper': '1.0 servings', 'butter': '0.25 tablespoon', 'milk': '0.13 cup'}","['leek', 'peas', 'parsley', 'fresh thyme', 'fresh basil', 'fresh sage', 'eggs', 'parmesan', 'nutmeg', 'salt and pepper', 'butter', 'milk']","Clean the leek and cut it into thin rings. Set aside.Chop all the herbs finely.Preheat the oven to 180 degrees Celsius/ 350 degrees Fahrenheit.Beat the eggs in a bowl, add a little less than 1/2 cup milk, 3 tablespoons of the grated Parmesan, and nutmeg. Season with salt and pepper.Melt the butter in a large oven-safe skillet and cook the leeks for a few minutes until bits of it are golden brown.Add the egg mixture, turn the heat to low and let the eggs cook until the bottom side sets but the top is still uncooked.Sprinkle with the remaining Parmesan.Place the pan in the hot oven. Finish cooking the eggs for about 15 minutes or until set on top and golden brown.Serve."
1098347,Homemade Banana Bread,75,8,https://spoonacular.com/recipeImages/1098347-312x231.jpg,[],0,"{'bananas': '0.38 ', 'flour': '0.19 cups', 'granulated sugar': '0.09 cup', 'butter': '0.04 cup', 'egg': '0.13 ', 'vanilla': '0.13 teaspoon', 'baking soda': '0.13 teaspoon', 'salt': '0.03 teaspoon', 'walnuts': '0.04 cup'}","['bananas', 'flour', 'granulated sugar', 'butter', 'egg', 'vanilla', 'baking soda', 'salt', 'walnuts']","Preheat oven to 350 degrees.Beat together butter, sugar, vanilla, egg.Add bananas.With a potato masher or a fork, mash in banana and mix well.Add flour, baking soda, and salt.Stir until everything is combined.Add nuts and stir again.Spray a loaf pan with non-stick cooking spray.Pour mixture into loaf pan.Cook for 55-65 minutes or until an inserted tooth pick comes out clean."
643153,Fluffy Spelt Pancakes,45,6,https://spoonacular.com/recipeImages/643153-312x231.jpg,[],0,"{'spelt flour': '0.17 cup', 'wheat bran': '0.04 cup', 'baking powder': '0.17 tablespoon', 'baking soda': '0.08 teaspoon', 'salt': '0.04 teaspoon', 'honey': '0.17 tablespoon', 'egg': '0.17 ', 'soy milk': '0.17 cup', 'butter': '0.17 tablespoon', 'vanilla extract': '0.33 teaspoons'}","['spelt flour', 'wheat bran', 'baking powder', 'baking soda', 'salt', 'honey', 'egg', 'soy milk', 'butter', 'vanilla extract']","Cup organic spelt flourCup wheat branTbs baking powderTsp baking sodaTsp saltAdd in 1 egg, 1 cup soy milk or low fat milk, 1 tbs melted butter, honey and 2 tsp vanilla extract into the dry ingredients.Heat dry flat non-stick pan, no need to oil it.Spoon 1/4 cup batter. A min or two on each side."
1161746,Peanut Butter Muffins,28,12,https://spoonacular.com/recipeImages/1161746-312x231.jpg,[],0,"{'flour': '0.1 cup', 'old fashioned oats': '0.06 cup', 'light brown sugar': '0.06 cup', 'baking powder': '0.13 tsp', 'salt': '0.04 tsp', 'milk': '0.1 cup', 'creamy peanut butter': '0.02 cup', 'egg': '0.08 '}","['flour', 'old fashioned oats', 'light brown sugar', 'baking powder', 'salt', 'milk', 'creamy peanut butter', 'egg']","Preheat the oven to 375 degrees Fahrenheit and lightly grease a muffin tin.In a large bowl mix together flour, oats, brown sugar, baking powder, and salt. Set aside.In a smaller bowl mix together peanut butter, egg, and milk.Pour the peanut butter mixture into the flour mixture and blend well.Fill the muffin tin with the batter until they are 3/4 of the way full.Bake for 18-23 minutes or until a toothpick comes out clean."
