id,title,readyInMinutes,servings,image,cuisines,dish,ingredients,grocery,instructions
1096183,Apple-Currant Granola,75,10,https://spoonacular.com/recipeImages/1096183-312x231.jpg,[],0,"{'rolled oats': '0.4 cups', 'slivered almonds': '0.1 cup', 'cinnamon': '0.2 teaspoons', 'ground allspice': '0.03 teaspoon', 'kosher salt': '0.1 teaspoon', 'unsweetened applesauce': '0.08 cup', 'maple syrup': '0.03 cup', 'honey': '0.3 tablespoons', 'coconut oil': '0.2 tablespoons', 'vanilla extract': '0.1 teaspoon', 'dried apples': '0.24 oz', 'dried currants': '0.05 cup'}","['rolled oats', 'slivered almonds', 'cinnamon', 'ground allspice', 'kosher salt', 'unsweetened applesauce', 'maple syrup', 'honey', 'coconut oil', 'vanilla extract', 'dried apples', 'dried currants']","Preheat oven to 300F. Line a rimmed baking sheet with parchment paper.Combine honey, maple syrup, applesauce, and coconut oil in a medium-sized saucepan.Bring this mixture to a boil. Immediately reduce heat to medium-low and simmer for about 5 minutes, stirring often.Once the mixture is a little thicker, remove from heat and add vanilla extract.Combine oats, almonds, cinnamon, allspice, and salt in a large bowl.Pour the honey/maple/applesauce mixture over the oat mixture. Stir thoroughly to evenly coat oat mixture with the applesauce mixture.Spread everything out evenly on your baking sheet.Bake for about 45 minutes. Give it a stir every 10 minutes and keep a close eye on it toward the end of the 45 minutes. The granola should be browned and crispy.Remove from oven and mix in the dried apples and currants.Cool completely and store in a large, airtight container."
1096246,Apple Cinnamon Quiche,45,6,https://spoonacular.com/recipeImages/1096246-312x231.jpg,"['Mediterranean', 'French', 'European']",0,"{'apples': '0.33 ', 'butter': '0.33 tablespoons', 'white sugar': '0.17 tablespoon', 'cinnamon': '0.17 teaspoon', 'unbaked pie shell': '0.17 ', 'cheddar cheese': '1.33 ounces', 'eggs': '0.67 large', 'whipping cream': '0.25 cups'}","['apples', 'butter', 'white sugar', 'cinnamon', 'unbaked pie shell', 'cheddar cheese', 'eggs', 'whipping cream']","Preheat the oven to 375 degrees Fahrenheit.In a large skillet, saute the apples in the butter over medium heat for 5 minutes.Transfer the apples into a large bowl, and toss with the sugar and cinnamon until well coated.Layer the apples in the pastry shell.Sprinkle the cheese evenly over the apple mixture.In a medium bowl, lightly whisk together the eggs and whipping cream until well blended.Pour the egg mixture over the apples and cheese.Bake for 35 minutes, or until set."
1096067,Portobello Baked Eggs,30,2,https://spoonacular.com/recipeImages/1096067-312x231.jpg,[],0,"{'portobello mushrooms': '1.0 ', 'eggs': '1.0 ', 'asiago cheese': '0.25 cup', 'thyme': '0.25 teaspoon', 'salt': '0.25 teaspoon', 'ground pepper': '1.0 servings', 'olive oil': '1.0 servings', 'parsley': '1.0 servings'}","['portobello mushrooms', 'eggs', 'asiago cheese', 'thyme', 'salt', 'ground pepper', 'olive oil', 'parsley']","Pre-heat oven to broil and move rack to 2nd to top position.Clean portobellos by wiping off the dirt with a damp paper towel.Remove stems, mist with an olive oil mister (or very lightly brush with oil if you don't have one), and sprinkle salt and pepper on each side.Place them on a baking sheet and broil for 3-5 minutes on each side.Turn oven down to 400 degrees.Remove portobellos then place the mushrooms cap side down and add shredded cheese and crack open an egg into the well of the portobello. Salt and pepper again and then bake for 15 minutes until egg white are cooked.Remove from oven, sprinkle with minced parsley, and serve."
639594,Classic Eggs Benedict,45,4,https://spoonacular.com/recipeImages/639594-312x231.jpg,['American'],0,"{'hollandaise sauce': '0.25 package', 'canadian bacon': '1.0 Slices', 'english muffins': '0.5 ', 'white vinegar': '0.13 teaspoon', 'eggs': '1.0 '}","['hollandaise sauce', 'canadian bacon', 'english muffins', 'white vinegar', 'eggs']","Prepare Knorr Hollandaise Sauce according to package instructions.Brown Canadian Bacon in a frying pan and toast English muffins. While bacon is cooking, poach the eggs.Fill a medium sized sauce pan half way with water.Add 1/2 teaspoon of white vinegar (this is optional but the vinegar helps hold the egg together). Bring to a gentle boil and carefully add eggs (1-2 at a time works best). Poach eggs for 2-3 minutes or until yolk has set to your preference.Remove eggs one at a time with a slotted spoon.Layer ingredients as follows: English muffin, Canadian Bacon, Eggs, Hollandaise Sauce."
1095713,Coconut Flour Muffins,45,10,https://spoonacular.com/recipeImages/1095713-312x231.jpg,[],0,"{'sea salt': '0.03 teaspoon', 'baking soda': '0.05 teaspoon', 'extra-virgin olive oil': '0.05 cup', 'coconut': '0.05 cup', 'coconut flour': '0.08 cup', 'vanilla extract': '0.1 teaspoon', 'eggs': '0.6 pieces'}","['sea salt', 'baking soda', 'extra-virgin olive oil', 'coconut', 'coconut flour', 'vanilla extract', 'eggs']","Preheat the oven to 350 degrees Fahrenheit.Mix the dry ingredients in a small bowl. Set aside.In a separate bowl, mix coconut oil, coconut nectar syrup, pure vanilla extract, and beaten eggs.Slowly add the dry ingredients.Mix until well blended.Leave for 5 minutes to let the flour absorb the liquid. While waiting, grease a muffin pan.Scoop the muffin batter into the pan. Fill it until it is  full.Bake for 30 minutes.Let the muffins cool before taking out of the pan.Serve."
644045,Fruity Yogurt Parfait,45,3,https://spoonacular.com/recipeImages/644045-312x231.jpg,[],0,"{'plain yogurt': '0.33 cup', 'orange juice': '0.67 teaspoons', 'kiwi': '0.33 ', 'mango': '0.17 ', 'strawberries': '1.33 '}","['plain yogurt', 'orange juice', 'kiwi', 'mango', 'strawberries']",Simply layer fresh fruits and yogurt in a pretty glassAdd more mixed fruits on top and serve.
638604,Chilled Swiss Oatmeal,10,1,https://spoonacular.com/recipeImages/638604-312x231.jpg,[],0,"{'old-fashioned oatmeal': '0.5 cup', 'vanilla yogurt': '6.0 oz', 'milk': '0.33 cup', 'apple': '1.0 small', 'banana': '1.0 small', 'cranberry': '2.0 tablespoon', 'walnuts': '1.0 tablespoon'}","['old-fashioned oatmeal', 'vanilla yogurt', 'milk', 'apple', 'banana', 'cranberry', 'walnuts']","-In a small bowl, add oatmeal, yogurt, milk and combine.Let it sit for few minutes or several hours in the refrigerator.  Then add apples, banana, dried fruits and stir until well combined. Top with nuts before serving.Note: it tastes best when allowed to sit overnight.Add fruits right before serving to prevent browning and being mushy."
655313,Peanut Butter Granola,45,18,https://spoonacular.com/recipeImages/655313-312x231.jpg,[],0,"{'rolled oats': '0.08 cups', 'puffed rice cereal': '0.04 cup', 'raw sunflower seeds': '0.01 cup', 'hemp seeds': '0.01 cup', 'raw pumpkin seeds': '0.03 cup', 'sweet cherries': '0.08 cups', 'brown rice syrup': '0.04 cup', 'peanut butter': '0.04 cup'}","['rolled oats', 'puffed rice cereal', 'raw sunflower seeds', 'hemp seeds', 'raw pumpkin seeds', 'sweet cherries', 'brown rice syrup', 'peanut butter']","Preheat oven to 325 degrees Fahrenheit and line a medium baking sheet with parchment paper. Spray with coconut non-stick spray.In a large bowl, mix dry ingredients like the oats, millet, brown rice, nuts and seeds, and cherries.In a small bowl add the peanut butter and the brown rice syrup.Place in microwave for 30 seconds.Add wet ingredients to dry ingredients and mix well until evenly distributed. Reserve 1 1/2 cups on the side.Use the rest of the mixed ingredients and place on baking sheet. Pat until evenly distributed.Bake for 15 minutes or until lightly browned.Remove from oven and cool for 5-10 minutes. Using a knife, cut into 4x2 inche bars.Cool completely and then wrap individually in plastic wrap or store in a plastic container.Peanut Butter GranolaMakes 1 1/2 cupsSpread the rest of the mixture and loosely spread on baking sheet.Bake for 12-15 minutes and remove from oven and cool.Store in airtight container."
649824,Lemon Zucchini Muffins,45,10,https://spoonacular.com/recipeImages/649824-312x231.jpg,[],0,"{'whole wheat pastry flour': '0.15 cup', 'ground cinnamon': '0.1 tsp', 'ground nutmeg': '0.05 tsp', 'baking powder': '0.05 tsp', 'baking soda': '0.05 tsp', 'salt': '0.05 tsp', 'egg': '0.1 large', 'sugar': '0.07 cup', 'unsweetened applesauce': '0.05 cup', 'vegetable oil': '0.03 cup', 'yogurt': '0.2 Tbs', 'vanilla extract': '0.2 tsp', 'zucchini': '0.1 medium', 'lemon zest': '0.2 ', 'poppy seeds': '0.1 Tbs', 'walnuts': '0.03 cup'}","['whole wheat pastry flour', 'ground cinnamon', 'ground nutmeg', 'baking powder', 'baking soda', 'salt', 'egg', 'sugar', 'unsweetened applesauce', 'vegetable oil', 'yogurt', 'vanilla extract', 'zucchini', 'lemon zest', 'poppy seeds', 'walnuts']","Preheat oven to 375 F. Grease 10 muffin tins with oil or cooking spray.In a medium-sized bowl, sift together the flour, cinnamon, nutmeg, baking powder, baking soda, and salt. I like to add a heaping teaspoon of cinnamon because I love the flavor.In a large bowl, mix the egg, sugar, applesauce, oil, yogurt, and vanilla until well incorporated. Gradually mix the flour to the wet ingredients. I like to add the flour in three batches.Gently fold in the zucchini, lemon zest, poppy seeds, and walnuts.Spoon the mixture into the muffin pan until you fill up 10 of the tins.Bake for about 20-23 minutes, or until a toothpick comes out cleanly.Let the muffins cool for about 10 minutes."
639728,Coconut Bliss Smoothie,45,4,https://spoonacular.com/recipeImages/639728-312x231.jpg,[],0,"{'coconut': '0.25 serving', 'bananas': '0.5 ', 'mango': '0.25 ', 'coconut milk': '0.38 cups', 'pear': '0.19 ', 'unsweetened shredded coconut': '0.5 tablespoons', 'chia seeds': '0.5 tablespoons'}","['coconut', 'bananas', 'mango', 'coconut milk', 'pear', 'unsweetened shredded coconut', 'chia seeds']",Blend until smooth!Serve and Enjoy
1095888,Irish Brown Soda Bread,35,12,https://spoonacular.com/recipeImages/1095888-312x231.jpg,"['European', 'Irish']",0,"{'flour': '21.67 grams', 'wholemeal flour': '21.67 grams', 'salt': '0.08 teaspoon', 'baking soda': '0.08 teaspoon', 'buttermilk': '0.17 cups', 'egg': '0.08 '}","['flour', 'wholemeal flour', 'salt', 'baking soda', 'buttermilk', 'egg']","Combine both types of flour with baking soda and salt in a large bowl.Add the buttermilk and using a wooden spoon mix until you get nice dough.Transfer onto a floured surface and form into a loaf (do not knead, the less you work the dough the better). Using both hands make moves like if you wanted to lift the dough, then tuck it under and at the same time turn it in clockwise/anticlockwise direction. Repeat several times. This will shape the dough into a nice round loaf.Place the dough onto a baking tray lined with baking paper and mark a cross using a knife (you can also cut it into quarters, if you prefer smaller loaves).Brush with egg wash and place in a preheated oven.Bake at 200 C/400 F for 30 minutes or until ready (if you knock on the bottom of the bread and you hear a hollow sound you know its ready).Let it cool down on a wire rack before serving."
639482,Cinnamon Rolls by Bing,45,25,https://spoonacular.com/recipeImages/639482-312x231.jpg,[],0,"{'whole milk': '0.16 cups', 'vegetable oil': '0.04 cup', 'sugar': '0.04 cup', 'active yeast': '0.64 g', 'plain flour': '0.36 cups', 'baking powder': '0.04 teaspoon', 'baking soda': '0.04 teaspoon', 'salt': '0.04 pinch', 'butter': '0.24 tablespoons', 'brown sugar': '0.04 cup', 'ground cinnamon': '0.01 cup', 'pecan nuts': '0.08 cups', 'strong coffee': '0.01 cup', 'honey': '0.04 tablespoon', 'icing sugar': '0.08 cups', 'cream': '0.08 tablespoons'}","['whole milk', 'vegetable oil', 'sugar', 'active yeast', 'plain flour', 'baking powder', 'baking soda', 'salt', 'butter', 'brown sugar', 'ground cinnamon', 'pecan nuts', 'strong coffee', 'honey', 'icing sugar', 'cream']","Begin by pouring 4 C of whole milk into a large cooking pot.Add 1 C of sugar.Add 1 C of vegetable oil.Heat it over a medium flame and stir till sugar has dissolved. Do NOT boil.Set the mixture aside to cool till lukewarm. About 38 deg C. Check with your finger right into the mixture. If its hot, then cool some more. I should be just very mildly comfortably warm to the touch.When the mixture is lukewarm, add 2 packets of instant dry yeast (about 16g, 4.5 teaspoons).Sprinkle the yeast on the surface of the mixture. Leave it for 3 to 5 minutes. If the yeast is fresh and alive, you will see it growing and poofing up.Add 8 C of plain flour.Mix it all up together. Dont overmix.Cover with a table cloth and set aside covered in a warm place for 1 hour.After an hour, the dough would have risen to twice its size. Punch the dough down.Add the last C of flour.Add 1 heaping teaspoon of baking powder.Add 1 scant teaspoon of baking soda.Add 2 teaspoons of salt.Mix it up. Cover the dough again. And this time, either leave it in a warm place again for 1 hour. Or leave it covered in the fridge for 3 hours to rise slowly.Note: I left it in the fridge for 3 hours. The dough may be easier to manage when left to rise this way instead as it will be colder and harder.After the mentioned time, the dough would have risen again. Punch it down.Knead the dough for a few moments and then transfer the dough to the working table that has been lightly floured.If the dough is too wet at this stage. Chill it in the fridge for a while. Itll help.Flour a rolling pin. And roll out the dough into a huge long rectangle.Cut the dough into 2 parts. So that there are two long pieces of dough.Pour 2 cups of melted butter onto the rolled out dough.Note: Check your dough. If its VERY wet, reduce the amount of melted butter added at this stage. When the rolls are laid out in the pan later, pour the rest of the melted butter on them instead. I really prefer to add all the melted butter at this stage because the flavour goes right into the dough.Using fingers, evenly distribute the butter.Sprinkle 1/4 cup of cinnamon over the dough.Sprinkle 1 cup of castor sugar over the dough.Sprinkle 1 cup of brown sugar over the dough. As brown sugar gets clumpy. I scattered the sugar on the dough with my fingers.Chop some pecan nuts to get about 2 cups worth of chopped pecans.Sprinkle the chopped pecan nuts onto the rolled dough.Roll up the dough, lengthwise. It will be a really long roll. If the dough is very wet and you are struggling to roll it, add some flour to the surfaces to help you roll.Cut into 1 inch thick rolls.Rub pans or baking dishes generously with more melted butter.Place the cinnamon rolls comfortably in each pan/dish. Do not overcrowd as they will expand alot in the pan.Pour remaining butter over the rolls. Dont be afraid!Set them aside for 1 hour. If theres wind/draft in your kitchen, cover the rolls with table cloths. The rolls will rise some more.Pop the rolls into a oven, preheated at 180 deg Celsius.Bake for 15 to 17 minutes.While the rolls are baking, make the icing. Dont get stressed about the proportions. Just mix the ingredients till you get a gooey consistency to pour over like syrup.Make a 1/4 cup of strong coffee with 1/4 cup water and one 3-in-1 coffee mix.Add 1 tablespoon of the best honey you can get your hands on. Maple syrup works too.Stir the honey into the coffee.Add a pinch of salt.Add 6 tablespoons of melted butter.Add 2 cups of icing sugar.Whisk it all up.Add 1 to 2 tablespoons of fresh cream.Stir in the cream.Pour the icing over the rolls while they are still hot."
650377,Low Carb Brunch Burger,30,2,https://spoonacular.com/recipeImages/650377-312x231.jpg,['American'],0,"{'avocado': '0.5 ', 'bacon': '2.0 strips', 'cumin': '1.0 servings', 'eggs': '1.0 ', 'garlic powder': '1.0 servings', 'ground beef': '0.5 lb', 'onion powder': '1.0 servings', 'bell pepper': '1.0 servings', 'salt': '1.0 servings', 'sharp cheddar': '1.0 large slices', 'tabasco sauce': '1.0 dashes', 'worcestershire sauce': '1.0 dashes'}","['avocado', 'bacon', 'cumin', 'eggs', 'garlic powder', 'ground beef', 'onion powder', 'bell pepper', 'salt', 'sharp cheddar', 'tabasco sauce', 'worcestershire sauce']","Fry up 4 strips of bacon and set aside.Leave some of the bacon fat in the pan but remove from the eye.Put all of the spices and sauces into the ground beef, mix well and form even patties.Heat a large non-stick skillet until the pan (with some of the bacon fat in it) is hot.Place patties in hot pan and sear for 1 minute and 30 seconds each side. After searing the burgers, remove them from stove top and bake off in the oven at 415 degrees until it reaches your desired temperature (3-4 minutes).While the burgers are in the oven, get your egg going. On the same hot eye where you did your burger, use a new non-stick pan for the eggs. On the two over easy eggs, grind 2 grinds of salt, 2 grinds of pepper and a dash of Tabasco onto each egg yolk.Add the cheese on the burgers when the burgers have about 1 minute of cook time remaining, so the cheese melts."
638936,Chocolate Chip Muffins,45,4,https://spoonacular.com/recipeImages/638936-312x231.jpg,[],0,"{'all purpose flour': '0.44 cups', 'baking powder': '0.5 teaspoons', 'baking soda': '0.13 teaspoon', 'cocoa': '0.5 tablespoons', 'egg': '0.25 ', 'semi sweet chocolate chips': '0.19 cup', 'milk': '0.25 cup', 'sugar': '0.19 cup', 'vanilla extract': '0.25 teaspoon'}","['all purpose flour', 'baking powder', 'baking soda', 'cocoa', 'egg', 'semi sweet chocolate chips', 'milk', 'sugar', 'vanilla extract']","Preheat oven to 400degrees and fill muffin tin with paper cups.Measure the dry ingredients into a large bowl.Pour all the liquid ingredients into a measuring cup.Mix both together, remembering that a lumpy batter makes teh best muffins. Spoon into waiting cups.Sprinkle more chocolate chips on top, then cook for 20 minutes until muffins are dark, risen and springy."
638775,Chive and dill muffins,45,10,https://spoonacular.com/recipeImages/638775-312x231.jpg,[],0,"{'all purpose flour': '0.1 cup', 'yellow cornmeal': '0.1 cup', 'sugar': '0.1 Tbs', 'baking powder': '0.2 tsp', 'salt': '0.1 tsp', 'baking soda': '0.05 tsp', 'cayenne pepper': '0.05 tsp', 'dill': '0.03 cup', 'plain yogurt': '0.15 cups', 'eggs': '0.2 large', 'butter': '0.3 Tbs'}","['all purpose flour', 'yellow cornmeal', 'sugar', 'baking powder', 'salt', 'baking soda', 'cayenne pepper', 'dill', 'plain yogurt', 'eggs', 'butter']","Whisk flour, cornmeal, sugar, baking powder, salt, baking soda, and cayenne pepper in medium bowl. Stir in chives and dill.Whisk yogurt, eggs, and melted butter in another medium bowl.Add yogurt mixture to dry ingredients and stir just until blended.Divide batter among greased (or silicone) muffin cups, using about 1/3 cup batter for each standard muffin cup.Bake at 220C for 20 minutes or until muffins are puffed and golden (trick with a toothpick).Let muffins cool in muffin cups, then remove from the cups and serve warm."
1697671,Sour Cream Coffee Cake,60,12,https://spoonacular.com/recipeImages/1697671-312x231.jpg,[],0,"{'butter': '0.5 Tbsp', 'salt': '0.02 tsp', 'granulated sugar': '0.02 c', 'brown sugar': '0.06 c', 'baking soda': '0.08 tsp', 'baking powder': '0.08 tsp', 'vanilla extract': '0.08 Tbsp', 'eggs': '0.25 large', 'milk': '0.1 c', 'cream': '0.06 c', 'flour': '0.08 c', 'vegetable shortening': '0.08 serving', 'cinnamon': '0.13 tsp', 'cocoa powder': '0.13 tsp'}","['butter', 'salt', 'granulated sugar', 'brown sugar', 'baking soda', 'baking powder', 'vanilla extract', 'eggs', 'milk', 'cream', 'flour', 'vegetable shortening', 'cinnamon', 'cocoa powder']","Preheat oven to 350°F.Using a KitchenAid stand mixer or a handheld electric mixer, blend together butter, salt, sugars, baking soda, baking powder, and vanilla extract. Next, with mixer turning, add eggs one at a time, making sure that each is blended into the batter before adding the next one.In a separate bowl, using a spoon, mix together milk and sour cream. With mixer turning, alternate adding milk/sour cream mixture and flour to the batter.Pour half the cake batter into a greased 9 x 13 baking dish and spread it out evenly.In a small bowl, using a spoon, mix together brown sugar, cinnamon, flour, and cocoa powder.Sprinkle generously over the first layer of cake batter. This will make the middle filling layer.Spread the rest of the cake batter over the top. Finally, in another bowl, mix together butter, sugars, cinnamon, and flour to make the crumb topping. Keep mixing it with a fork or spoon until crumbles form.Sprinkle over the top of the cake.Bake the coffee cake for 45 to 50 minutes, or until a toothpick comes out mostly clean."
637478,Chavrie Spinach Quiche,45,8,https://spoonacular.com/recipeImages/637478-312x231.jpg,"['Mediterranean', 'French', 'European']",0,"{'goat cheese': '0.66 oz', 'eggs': '0.5 ', 'crème fraîche': '0.75 ounces', 'half and half': '0.75 ounces', 'cayenne': '0.06 teaspoon', 'salt': '0.06 teaspoon', 'ground pepper': '0.03 teaspoon', 'pie crust': '0.13 serving', 'frozen spinach': '0.13 package', 'nutmeg': '0.13 pinch'}","['goat cheese', 'eggs', 'crème fraîche', 'half and half', 'cayenne', 'salt', 'ground pepper', 'pie crust', 'frozen spinach', 'nutmeg']","Blend Chavrie with eggs and mix well.Add cream and half and half to make custard and season with salt, pepper, cayenne and nutmeg.Scatter the spinach evenly over the bottom of the pre-baked piecrust.Pour custard into the shell stirring with a fork to evenly distribute the spinach.Bake at 350 F for 45 minutes, until a knife blade inserted into it comes out clean.Let rest and serve warm."
635413,Blueberry Banana Bread,45,15,https://spoonacular.com/recipeImages/635413-312x231.jpg,[],0,"{'flour': '0.05 cup', 'baking soda': '0.07 teaspoon', 'cinnamon': '0.03 teaspoon', 'salt': '0.03 teaspoon', 'rolled oats': '0.03 cup', 'unsweetened applesauce': '0.13 tablespoons', 'sugar': '0.02 cup', 'bananas': '0.07 cup', 'lemon juice': '0.07 tablespoon', 'blueberries': '0.07 cup'}","['flour', 'baking soda', 'cinnamon', 'salt', 'rolled oats', 'unsweetened applesauce', 'sugar', 'bananas', 'lemon juice', 'blueberries']","Sift together the first five dry ingredients. Stir in rolled oats; set aside.Combine well the applesauce, sugar, and egg whites.Add bananas and lemon juice. Carefully, stir in blueberries.Add to the dry ingredients and mix just until moistened.Pour into an 81/2 x41/2 x3-inch loaf pan coated with cooking spray.Bake= at 350 F. for about 40 minutes or until done.Let bread cool in pan about 10 minutes. Turn out on a wire rack to cool completely. Wrap and refrigerate several hours before slicing.Makes oneloaf (15 slices)."
1697655,Homemade Cinnamon Rolls,135,12,https://spoonacular.com/recipeImages/1697655-312x231.jpg,[],0,"{'warm milk': '0.08 c', 'yeast': '0.21 tsp', 'granulated sugar': '0.04 c', 'eggs': '0.17 large', 'butter': '0.03 c', 'vanilla extract': '0.08 tsp', 'salt': '0.08 tsp', 'flour': '0.33 c', 'brown sugar': '0.06 c', 'cinnamon': '0.17 Tbsp', 'cream cheese': '0.5 oz', 'powdered sugar': '0.13 c'}","['warm milk', 'yeast', 'granulated sugar', 'eggs', 'butter', 'vanilla extract', 'salt', 'flour', 'brown sugar', 'cinnamon', 'cream cheese', 'powdered sugar']","Making the DoughPlace warm milk in a mixing bowl, add yeast, and give it a stir.Let it sit for a minute or two while you’re gathering your other ingredients. Next, add sugar, eggs, butter, salt, and vanilla, and mix well. Lastly, using a dough hook, add flour and mix until it forms a firm yet tacky dough that pulls away from the edges. Resist adding more flour…the dough should be slightly tacky.Remove dough from the mixer and knead by hand, on a lightly floured surface, for 5 minutes (yes, even if you used a stand mixer).First RisingGrease a large bowl with butter or cooking spray.Place the dough in this bowl, cover with a warm towel, and let sit in a warm spot for 1 to 1-½ hours or until it doubles in size.CinnamonRoll FillingIn a bowl, mix together brown sugar, cinnamon, and softened butter until it resembles a paste.Rolling out the dough, adding filling, and cutting into shapeFor this step, I used silicone baking mats, but you can also roll out the dough on a lightly floured surface. With a lightly floured rolling pin, roll out the dough into a rectangle, measuring approximately 22” x 14”.Drop some of the cinnamon roll filling here and there over the rolled out dough. Then, using a rubber spatula, gently spread the filling all over the dough, keeping away from the edges by about a quarter inch.Starting at a short end (one of the 14” ends), gently but tightly roll the dough into one long roll.Using a sharp knife (I found that a serrated knife worked best), cut the roll into 12 evenly sliced pieces. Second RisingPreheat oven to 350℉.Place the cut cinnamon rolls into a parchment-lined baking dish, three rows of four. Cover the dish with plastic wrap and let the rolls rise for another 30 minutes, or until they’ve nearly doubled in size.Baking CinnamonRollsRemove the plastic wrap and place baking pan in the oven on the middle rack.Bake for 20 – 30 minutes. My cinnamon rolls took 30 minutes to bake, but you should start checking on them after 20 minutes. All ovens are different. The cinnamon rolls will be done when the tops have just lightly browned and the dough sounds hollow when you lightly tap on it with a spoon. The rolls will rise even more while they’re baking and will most likely touch each other. This is fine and good…they’ll stay soft in the middle.Icing for CinnamonRollsWhile the rolls are baking, make the icing. Using either a stand mixer or handheld mixer, blend together cream cheese, powdered sugar, butter, and vanilla until smooth. When the cinnamon rolls are done baking, let them cool about 5 minutes and add icing to the tops, so it will slightly melt and ooze between the swirls. If you prefer the icing thicker on top, wait until they’ve fully cooled. "
